title,directions,Ingridents,link
Mother'S Herb Rice(1942)  ,"[""Put rice, onions, butter and broth in cooking dish or pan."", ""Mix all spices (herbs) together and sprinkle on top of rice and broth. Cover and cook for 20 minutes at 350\u00b0."", ""Do not stir while cooking.""]","[""curry"", ""basil"", ""thyme"", ""chicken broth"", ""onions"", ""sage"", ""marjoram"", ""rice"", ""butter"", ""salt""]",www.cookbooks.com/Recipe-Details.aspx?id=200331
Caramel Eggnog,"[""In a medium saucepan, combine sugar, 2 tablespoons water, and lemon juice. Place remaining 4 tablespoons water near stove. Bring sugar mixture to a boil over medium heat, stirring constantly; cook for 5 minutes or until mixture is dark amber in color; remove from heat."", ""Gradually and carefully add water to sugar mixture or it may spatter. Stir until sugar mixture is dissolved. In a large bowl, whisk together eggs and milk. Stir in caramel mixture. Cook over medium-low heat for about 12 minutes or until mixture coats back of spoon. Immediately strain through a cheesecloth into a 6-cup bowl. Stir in vanilla, nutmeg and salt."", ""Cover and refrigerate until chilled. Just before serving , beat together whipping cream, liqueur, if desired, and icing sugar until soft peaks form. pour chilled eggnog int 2 quart serving bowl. Fold in whipped cream with whisk."", ""Sprinkle nutmeg on top if desired."", ""TIP: For a hit of holiday spirit, add dark rum to taste. Eggnog can be prepared ahead of time. It can be kept covered, 3-4 days in the refrigerator."", ""Whisk eggnog before serving.""]","[""sugar"", ""vanilla"", ""lemon juice"", ""nutmeg"", ""eggs"", ""ground nutmeg"", ""hazelnut-flavored liqueur"", ""water"", ""icing sugar"", ""milk"", ""cream"", ""salt""]",www.food.com/recipe/caramel-eggnog-343263
Chicken Enchiladas with Pasilla Chili Sauce,"[""Heat 2 tablespoons oil in large pot over high heat."", ""Add chilies and almonds."", ""Saute until chilies darken and almonds are golden, about 2 minutes."", ""Using slotted spoon, transfer chilies and almonds to bowl."", ""Reduce heat to medium."", ""Season chicken with salt and pepper."", ""Add to same pot and brown on all sides, about 5 minutes."", ""Add stock; simmer until chicken is cooked through, aobut 20 Transfer chicken to another bowl using slotted spoon; cool."", ""Reserve stock in pot."", ""Toast cumin seeds in heavy small skillet over medium-low heat until aromatic, about 1 minute."", ""Mince cumin seeds."", ""Add cumin, chili mixture, tomatoes, quartered onion, garlic, sugar and salt to stock."", ""Simmer until all ingredients are very soft, about 45 minutes."", ""Working in batches, puree stock mixture in blender."", ""Return to pot."", ""Boil until reduced to 4 cups, stirring occasionally, about 20 Season with salt and pepper."", ""(Can be made 1 day ahead."", ""Chill chicken and sauce separately.)"", ""Remove skin from chicken and discard."", ""Cut meat from bones and shred."", ""Transfer to bowl and combine with 1/2 cup sauce."", ""Set filling aside."", ""Oil two 13X9-inch glass baking dishes."", ""Pour oil into deep skillet to depth of 1/2 inch and heat to 375-degree F."", ""Fry tortillas 1 at a time until softened, about 5 seconds per side."", ""Using metal sapatula, transfer to paper towels."", ""Spread 1 tablespoon sauce over each tortilla."", ""Sprinkle each with 2 tablespoons cheese and 1 tablespoon chooped onion."", ""Place 13 cup chicken down center of each tortilla; roll up."", ""Place seam side down in baking dishes."", ""(Can be made 1 hour ahead."", ""Cover.)"", ""Preheat oven to 350F (180C)"", ""Pour remaining sauce over enchiladas."", ""Sprinkle with remaining cheese."", ""Bake until heated through, about 20 minutes."", ""Top with creme fraiche, avodado and cilantro.""]","[""tomatoes"", ""brown sugar"", ""salt coarse"", ""cilantro"", ""peanut oil"", ""chicken breast halves"", ""cumin seeds"", ""chicken broth"", ""onions"", ""avocados"", ""corn tortillas"", ""creme fraiche"", ""chiles"", ""garlic"", ""almonds""]",recipeland.com/recipe/v/chicken-enchiladas-pasilla-chil-46925
Oreo Cookie Cheesecake,"[""In a food processor, whirl 1/2 package of the cookies, including filling, until they form fine crumbs; mix in butter. Scoop crumbs into a 9-inch cheesecake pan with removable bottom and press crumbs evenly over bottom of pan and about 1/2-inch up sides. Chill crust to firm, about 20 minutes.""]","[""sugar"", ""vanilla"", ""eggs"", ""cream cheese"", ""flour"", ""oreos"", ""butter"", ""whipping cream""]",www.cookbooks.com/Recipe-Details.aspx?id=948514
Chicken Divan,"[""Boil chicken with onion, celery tops and salt."", ""Strip from bones."", ""Cook broccoli and drain."", ""Mix rest of ingredients to form sauce."", ""Grease a 2-quart casserole."", ""Put broccoli on bottom and bite-size meat on top."", ""Pour on sauce."", ""Sprinkle with 3/4 cup grated Cheddar cheese on top."", ""Sprinkle crumbs of Ritz crackers or bread crumbs."", ""Dot with butter."", ""Bake 45 minutes at 350\u00b0."", ""Serves 6.""]","[""cream of chicken soup"", ""miracle"", ""chicken breasts"", ""lemon juice"", ""curry powder"", ""frozen broccoli"", ""worcestershire sauce""]",www.cookbooks.com/Recipe-Details.aspx?id=207931
Easy Chili Mac,"[""Brown ground beef. When it is about half done press garlic into pan and add onion."", ""cook till ground beef is done onions should be clear drain grease."", ""While cooking ground beef cook macaroni acording to box. Drain macaroni."", ""Add diced tomatos and tomato sauce Stir."", ""Add chilli powder and cumin Stir."", ""Add macaroni Stir."", ""Add salt. Season to taste. Stir."", ""Serve and top with chedder cheese makes.""]","[""ground cumin"", ""tomatoes"", ""salt"", ""chili powder"", ""cheddar cheese"", ""onion"", ""ground beef"", ""garlic"", ""tomato sauce""]",www.food.com/recipe/easy-chili-mac-224681
Brown Rice,"[""Melt butter, then add all ingredients."", ""Pour in baking dish and cook 45 minutes at 350\u00b0.""]","[""consomme beef soup"", ""onion"", ""butter"", ""long grain rice""]",www.cookbooks.com/Recipe-Details.aspx?id=679129
Sex-In-A-Pan,"[""Mix together the icing sugar, margarine, flour, and chopped pecans and press into a 9X13\"" pan."", ""Bake for about 15 minutes at 350 degrees F; Cool."", ""Mix cream cheese, white sugar, and ONE cup of cool whip; Spread on cool base."", ""Mix both packages of pudding and add 3 cups of milk."", ""Beat and spread on filling layer (don't worry it will thicken as it cools)."", ""Spread remaining cool whip on top, add some shaved chocolate if you want and set in the fridge.""]","[""milk"", ""pecans"", ""cream cheese"", ""flour"", ""margarine"", ""icing sugar"", ""vanilla pudding"", ""white sugar"", ""chocolate shavings"", ""chocolate pudding""]",www.food.com/recipe/sex-in-a-pan-42741
Vinegar Gravy,"[""Melt the butter in a large frying pan."", ""Cook it until it is a medium dark brown."", ""Carefully add the vinegar."", ""Be real careful because the vinegar will cause the butter to boil and foam."", ""When it is done foaming pour into a gravy boat and serve.""]","[""cider vinegar"", ""butter""]",www.food.com/recipe/vinegar-gravy-252312
Baked Haddock Filets With Sour Cream,"[""Season filets with salt and pepper."", ""Stir all but filets well. Spread over filets in buttered, shallow dish."", ""Bake for 10 minutes or until bubbly and fish flakes.""]","[""sour cream"", ""sugar"", ""onion"", ""thyme"", ""dill"", ""haddock filets"", ""butter"", ""bay leaf"", ""salt""]",www.cookbooks.com/Recipe-Details.aspx?id=542304
Key West Key Lime Pie,"[""In a bowl fold first 3 ingredients together and pour into graham cracker crust."", ""Chill in refrigerator for 4 hours to allow mixture to firm up.""]","[""condensed milk"", ""limeade"", ""graham cracker pie crust""]",www.cookbooks.com/Recipe-Details.aspx?id=454125
Crispy Fried Okra,"[""Heat oil in large skillet until very hot."", ""Slice off pod end of okra. Cut okra into 1/2 inch pieces. Rinse the pieces in a colander."", ""In a large bowl, mix cornmeal, flour, salt and pepper. Add okra and toss well to coat. Scoop the okra into a slotted spoon and shake off excess breading. Add to hot skillet and fry 5-6 minutes or until crispy golden. Remove with slotted spoon to a paper towel lined platter or basket. Sprinkle with additional salt, if desired.""]","[""\u00bc"", ""canola oil"", ""salt"", ""cornmeal""]",tastykitchen.com/recipes/sidedishes/crispy-fried-okra/
Raspberry Coffee Pie,"[""Crust Directions:."", ""Put all dry ingredients to pie crust in 9-inch pie pan."", ""Mix oil and milk together, and pour over flour mix."", ""Mix with fingers just til all moist."", ""Press into pan."", ""Poke w' fork on bottoms and sides and bake at 350F 8-10 minutes."", ""Pie Directions:."", ""Sprinkle Gelatin and coffee over the water in small saucepan."", ""Heat til gelatin dissolves, stirring constantly."", ""Remove from heat and let cool some."", ""In mixing bowl, mix cream cheese, sugar, salt, and vanilla til fluffy."", ""Beat in warm gelatin mix gradually (VERY IMPORTANT TO DO IT GRADUALLY AND CONTINUOUSLY OR IT WILL BE LUMPY) Chill until thickened."", ""Beat with beaters to soften some, add cool whip and beat til mixed well and fluffy."", ""Put about half the mix into backed pie shell, making a dipped area to hold the berries."", ""Add drained raspberries, top with remaining coffee filling."", ""Chill about 2 hours before serving.""]","[""unflavored gelatin"", ""sugar"", ""vanilla"", ""frozen raspberries"", ""cream cheese"", ""water"", ""flour"", ""milk"", ""instant coffee"", ""vegetable oil"", ""salt""]",www.food.com/recipe/raspberry-coffee-pie-272106
Easy Ginger-Lover'S Skillet Beef,"[""Slice the beef diagonally across the grain into very thin slices."", ""Season the beef slices with salt and pepper."", ""Heat oil in a skillet over high heat; add in ginger and saute for 2 minutes or until tan-coloured."", ""Add in garlic and red pepper flakes and saute for 30 seconds."", ""Add in beef; cook for 2 minutes, stirring constantly, then add in soy sauce."", ""In a small cup or bowl stir together beef broth and cornstarch until smooth, then drizzle over the beef in the skillet; cook stirring constantly for 1 minute or until thickened."", ""Add in green onions and cook for another minute."", ""Season with more black pepper if desired."", ""Serve over cook rice.""]","[""sirloin beef"", ""ginger"", ""black pepper"", ""soy sauce"", ""green onions"", ""white rice"", ""red pepper"", ""beef broth"", ""cornstarch"", ""fresh garlic""]",www.food.com/recipe/easy-ginger-lovers-skillet-beef-205313
Miniature Cheesecakes,"[""Line cupcake tins with cupcake liners."", ""Place 1 vanilla wafer in each liner."", ""Mix cream cheese, vanilla and sugar until well blended."", ""Add eggs."", ""Mix until smooth."", ""Pour over wafers to 3/4 full."", ""Bake 25 minutes at 325\u00b0."", ""Top with fruit or sour cream and fruit when cool.""]","[""sugar"", ""vanilla"", ""eggs"", ""vanilla wafers"", ""cream cheese""]",www.cookbooks.com/Recipe-Details.aspx?id=19662
Asian Noodles With Asparagus And Shrimp,"[""Cook noodles according to package directions, omitting salt and fat."", ""Meanwhile, combine chicken broth and the next 6 ingredients, stirring well."", ""Heat vegetable oil in a large nonstick skillet over med-high heat."", ""Add in garlic; stir/saute 45 seconds; add in asparagus; stir/saute 2 minutes."", ""Add in shrimp and stir/saute 2 minutes or until shrimp are done."", ""Add in broth mixture and onions to pan; cook over medium heat until hot."", ""Add in noodles, tossing gently to coat.""]","[""sugar"", ""soy sauce"", ""fresh ginger"", ""noodles"", ""peanut butter"", ""rice vinegar"", ""green onion"", ""chicken broth"", ""dark sesame oil"", ""shrimp"", ""garlic"", ""vegetable oil""]",www.food.com/recipe/asian-noodles-with-asparagus-and-shrimp-226395
H.E.B.T.,"[""Take a tortilla and place a slice of ham on it."", ""Place some scrambled eggs on top of that."", ""Place 1 cup of beans over the top of the eggs."", ""Fold it up burrito style."", ""Repeat directions with all tortillas and the remaining fillings."", ""Enjoy!""]","[""flour tortillas"", ""eggs"", ""beans"", ""ham""]",tastykitchen.com/recipes/main-courses/h-e-b-t/
Drago's Potato Soup,"[""In a large saucepan,saute the celery and the onion in butter until tender."", ""Stir in the gravy mix and seasonings gradually add milk."", ""Bring to a boil cook and stir for 2 minutes."", ""Reduce heat stir in the potatoes and cheese."", ""Cook and stir until the potatoes are heated through and the cheese is melted.""]","[""celery salt"", ""potatoes"", ""cajun seasoning"", ""american cheese"", ""ground cumin"", ""pepper"", ""green onion"", ""chicken gravy mix"", ""onion"", ""celery"", ""milk"", ""butter""]",www.food.com/recipe/dragos-potato-soup-53593
Swiss Cheese Spread,"[""Mix all in food processor."", ""Refrigerate."", ""Spread on bread for sandwiches.""]","[""bacon"", ""cayenne pepper"", ""swiss cheese"", ""celery"", ""onions"", ""mayonnaise"", ""garlic"", ""salt""]",www.food.com/recipe/swiss-cheese-spread-321701
She-Crab Soup,"[""Melt butter in top of a double boiler over hot water. Add onion, salt, and pepper; stir well. Stir in flour, mixing well. Add crab meat; cook 5 minutes."", ""Combine milk, whipping cream, and Worcestershire sauce. Gradually add milk mixture to crab meat mixture, stirring well. Heat thoroughly. Ladle soup into individual serving bowls. Add sherry to taste. Serve immediately.""]","[""pepper"", ""whipping cream"", ""onion"", ""crab meat"", ""flour"", ""milk"", ""sherry"", ""butter"", ""worcestershire sauce"", ""salt""]",www.myrecipes.com/recipe/she-crab-soup-0
Chocolate Chip Cheese Cake,"[""Whip cream cheese and sugar then sour cream; add cool whip and chocolate chips."", ""Chill a few hours.""]","[""sour cream"", ""sugar"", ""cool whip"", ""cream cheese"", ""chocolate chips""]",www.cookbooks.com/Recipe-Details.aspx?id=77644
"""Chip Beef Gravy"" Recipe","[""In skillet, heat 4 Tbsp."", ""butter."", ""Break up 1 package dry chipped beef into small pcs and brown."", ""Sprinkle 4 Tbsp."", ""flour over beef, mix well."", ""Then add in 2 1/2 c. lowfat milk slowly."", ""Cook over low heat, stirring constantly."", ""Makes 6 servings.""]","[""flour"", ""beef"", ""butter"", ""milk""]",cookeatshare.com/recipes/chip-beef-gravy-4939
Chocolate Mint Cheesecake Charlotte,"[""Prep."", ""Cut cake into 1/4-inch-thick slices."", ""Chop peppermint patties and cookies."", ""Steps."", ""Place milk and filling mix in medium bowl; beat with mixer on low 1 minute."", ""Add chopped patties; mix on high 34 minutes or until thick."", ""Line 3-quart dessert bowl with cake slices, covering bottom and sides (reserving some slices for top)."", ""Spoon one-half of the filling over the cake slices, then add one-half of the cookie crumbs; repeat."", ""Finish with a layer of cake slices."", ""Chill 30 minutes or until firm."", ""Invert dessert onto serving plate before slicing, if desired."", ""Serve with whipped topping.""]","[""chocolate peppermint patties"", ""topping"", ""mint cookies"", ""butter"", ""cold milk"", ""cheesecake mix""]",www.food.com/recipe/chocolate-mint-cheesecake-charlotte-476830
Pound Cake,"[""Cream margarine and sugar well."", ""Add eggs one at a time, then add flour, 1 cup at a time."", ""Pour into a greased and floured 10-inch tube pan."", ""Put in cold oven and bake at 350\u00b0 for 1 1/2 hours.""]","[""flour"", ""eggs"", ""margarine"", ""sugar""]",www.cookbooks.com/Recipe-Details.aspx?id=547402
Blueberry Surprise French Toast Casserole,"[""Place half of the bread cubes over the bottom of a well-buttered 13x9x2-inch baking dish."", ""Sprinkle cream cheese and blueberries over bread cubes."", ""Arrange remaining bread cubes over blueberries."", ""In a large mixing bowl, beat eggs with a rotary beater, beat in milk and the 1/2 cup syrup."", ""Carefully pour egg mixture over the bread mixture."", ""Cover and chill in the refrigerator for 2 to 24 hours."", ""Bake, covered, in a 375 oven for 25 minutes."", ""Uncover and bake about 25 minutes more or till a knife inserted near the center comes out clean, and topping is puffed and golden brown."", ""Let stand for 10 minutes before serving."", ""Serve warm with blueberry-flavored or maple syrup."", ""NOTE: To dry bread slices, arrange bread in a single layer on a wire rack, cover loosely and let stand overnight."", ""Or cut bread into 1/2-inch cubes, spread in a large baking pan."", ""Bake, uncovered in a 300 oven for 10 to 15 minutes or till dry, stirring twice, cool.""]","[""eggs"", ""fresh blueberries"", ""cream cheese"", ""maple syrup"", ""milk"", ""white bread""]",www.food.com/recipe/blueberry-surprise-french-toast-casserole-46719
"Pineapple, Ginger, Celery And Flax Juice (For The Juicer)","[""Wash the pineapple and celery. Process with the ginger through the juicer."", ""Stir oil into the juice and mix well."", ""Pour into a chilled glass and enjoy immediately!""]","[""flax seed oil"", ""stalks celery"", ""gingerroot"", ""fresh pineapple""]",www.food.com/recipe/pineapple-ginger-celery-and-flax-juice-for-the-juicer-481885
Green Bake,"[""Sprinkle 1/4 cup bread crumbs into a greased 8-in."", ""square baking dish."", ""Bake at 350 for 3-5 minutes or until golden brown."", ""In a bowl, combine the remaining ingredients."", ""Spread over toasted bread crumbs."", ""Bake uncovered at 350 degrees for 45 min or until knife inserted into center comes out clean."", ""Let sit for 5-10 min before serving.""]","[""eggs"", ""parmesan cheese"", ""bread crumbs"", ""cottage cheese""]",www.food.com/recipe/green-bake-210533
Pretzel Salad,"[""Combine the first 2 ingredients in saucepan."", ""Let come to boil."", ""Stir often."", ""Set aside to cool."", ""Mix the pretzels, 1/4 cup sugar and melted margarine together well."", ""Press into a 10 x 6 1/2-inch baking dish."", ""Blend cheese and 1/2 cup sugar until fluffy."", ""Blend in Cool Whip."", ""Spread over pretzel mixture."", ""Spread first mixture over all."", ""Chill several hours.""]","[""sugar"", ""cream cheese"", ""cornstarch"", ""pretzels"", ""margarine"", ""pineapple""]",www.cookbooks.com/Recipe-Details.aspx?id=385254
Cranberry Orange Bread,"[""Preheat oven to 350\u00b0F. Grease and flour a 9x5 inch loaf pan or individual smaller loaf pans."", ""Sift together flour, baking powder, baking soda and salt. Whisk in zest, cranberries, and almonds."", ""In a large bowl of stand mixer, cream together butter, sugar and egg until light and fluffy. Blend in orange juice. Take off mixer and blend in flour with wooden spatula until moistened. Mixture will be thick."", ""Spread into prepared pan(s). Bake 50 minutes to 1 hour, until a wooden pick/tester inserted in center comes out clean. Let stand in pan for 10 minutes then turn over on to wire rack to cool completely."", ""Recipe adapted from Allrecipes Cranberry Orange Loaf.""]","[""egg"", ""baking powder"", ""sugar"", ""baking soda"", ""\u00bc"", ""all-purpose"", ""fresh cranberries"", ""orange juice"", ""almonds"", ""salt""]",tastykitchen.com/recipes/breads/cranberry-orange-bread-2/
Waldorf Salad,"[""In medium bowl, toss together the chopped apple and lemon juice."", ""Stir in raisins, grapes and celery.""]","[""lettuce leaves"", ""apple"", ""lemon juice"", ""white grapes"", ""celery"", ""raisins"", ""mayonnaise"", ""walnuts"", ""plain yogurt""]",www.cookbooks.com/Recipe-Details.aspx?id=761582
"Shrimp Dip - Appetizer(""Quick And Easy"")  ","[""Mix all of the above well."", ""If too thick, add 1 tablespoon milk until creamy."", ""Refrigerate."", ""Serve with crackers.""]","[""onion"", ""cream cheese"", ""parsley"", ""shrimp"", ""salt""]",www.cookbooks.com/Recipe-Details.aspx?id=396741
Spring Asparagus Beef Stir-fry,"[""In a small bowl, combine the sliced beef with 1 teaspoon oil, 1 teaspoon light soy sauce and 1 teaspoon cornstarch."", ""Set aside."", ""Wash your asparagus, and cut about an inch off the bottom ends, depending on how tender they are."", ""You can also use a vegetable peeler to peel the bottom of each stalk."", ""Slice the remaining stalks into 2-inch pieces on an angle."", ""Next combine the salt, sugar, the rest of the light soy sauce (4 teaspoons), dark soy sauce, sesame oil, and stock or water into a bowl."", ""Mix well and set aside."", ""Have your wine measured out, garlic ready, and the cornstarch slurry mixed up before you begin cooking, because this is all going to happen very fast!"", ""Heat your wok until its smoking."", ""Add a couple tablespoons of oil and swirl it around to coat your wok."", ""Quickly spread the beef slices around the wok in an even layer."", ""Let it sear for 15-30 seconds without stirring."", ""Then give it a quick stir to sear the other side."", ""The meat should be browned and no sticking should happen if you got the wok hot enough!"", ""Take the beef out of the pan and set aside on a plate."", ""Keep the wok on high heat and add another tablespoon of oil into the wok."", ""Stir in your garlic and asparagus."", ""Stir for about 10 seconds then add the Shaoxing wine around the rim of the wok."", ""Cover the wok, leaving the heat on high."", ""Let it cook for 20 to 30 seconds."", ""Remove the cover and add the sauce mixture and the white pepper."", ""Add the beef back to the pan and stir."", ""Let the liquid bubble up."", ""Stir up your cornstarch slurry to make sure the starch is dissolved and pour in about half of it."", ""Stir for a few seconds."", ""If the sauce is still thin, add more slurry."", ""If its too thick, add a little water or stock."", ""Plate and serve immediately!""]","[""oil"", ""sugar"", ""soy sauce"", ""white pepper"", ""water"", ""shaoxing wine"", ""cornstarch"", ""sesame oil"", ""garlic"", ""chicken"", ""salt""]",tastykitchen.com/recipes/main-courses/spring-asparagus-beef-stir-fry/
Cranberry Relish From Tyler Florence,"[""Put cranberries in food processor (or blender)."", ""Top with suger, orange zest, orange juice and a shot of Grand Marnier."", ""Pulse in short bursts until desired consistency.""]","[""frozen cranberries"", ""orange"", ""sugar"", ""grand marnier""]",www.food.com/recipe/cranberry-relish-from-tyler-florence-509802
Philly Cream Cheese Apricot Cookies,"[""Combine margarine, granulated sugar and cream cheese; mixing until well blended."", ""Blend in eggs, juice and rind."", ""Add combined flour and baking powder; mix well."", ""Chill several hours."", ""Shape level tablespoonful of dough into balls."", ""Place on ungreased cookie sheet; flatten slightly, indent centers; fill with preserves."", ""Bake at 350\u00b0 for 15 minutes."", ""Cool; sprinkle with powdered sugar."", ""Makes approximately 7 dozen.""]","[""sugar"", ""baking powder"", ""lemon juice"", ""eggs"", ""powdered sugar"", ""cream cheese"", ""lemon rind"", ""flour"", ""margarine"", ""apricot preserves""]",www.cookbooks.com/Recipe-Details.aspx?id=659270
Chicken And Mushroom Soup,"[""Cut up chicken and cook in salt and pepper until meat is almost done."", ""Add celery (cut up) and green pepper."", ""Simmer for 5 minutes; add can of mushroom soup."", ""Cover 5 minutes more."", ""Cook until rice is done."", ""Separately follow instructions on rice box, preferably Uncle Ben's wild rice."", ""Serve chicken over rice.""]","[""green bell pepper"", ""stalks celery"", ""mushroom soup"", ""rice"", ""chicken"", ""salt""]",www.cookbooks.com/Recipe-Details.aspx?id=492015
Small Batch Spicy Chocolate Chip Cookies,"[""Preheat oven to 350\u00b0F."", ""In a medium-sized mixing bowl, cream the butter until light and smooth."", ""Add the sugars and cream together with the butter until fully incorporated."", ""Add the egg and beat rapidly until smooth."", ""Mix in the vanilla extract, then add the flour, baking soda, and crushed red pepper flakes. (You are supposed to sift the flour and baking soda together before adding them into the mixture, but I don't.)"", ""Lastly, add the milk chocolate morsels.""]","[""egg"", ""vanilla"", ""white granulated sugar"", ""brown sugar"", ""baking soda"", ""milk chocolate"", ""red pepper"", ""butter""]",www.yummly.com/recipe/Small-Batch-Spicy-Chocolate-Chip-Cookies-1672697
Dorowat,"[""Make the red pepper sauce first."", ""Combine the tomato sauce, wine, ginger, red pepper, cardamom, cinnamon and allspice."", ""Set red pepper sauce aside."", ""In a large skillet, cook onion and garlic not brown."", ""Stir in red pepper sauce, tumeric and add chicken pieces, spoon over onion mixture, bring to boil, reduce heat, cover and simmer, stir in 1/4 cup dry red wine."", ""Cook uncovered about 15 minutes."", ""Turn chicken pieces often."", ""Serve with Ethiopian flat bread.""]","[""nutmeg"", ""cardamom"", ""red pepper"", ""cinnamon"", ""cooking oil"", ""chicken"", ""root ginger"", ""onions"", ""red wine"", ""paprika"", ""turmeric"", ""allspice"", ""garlic"", ""clove"", ""tomato sauce""]",www.foodgeeks.com/recipes/18090
Oatmeal Cookies From My Dad ,"[""Same as the old oatmeal cookies: Bake at 350 for 18 minuets or the cookies become just cooked. Turn off your oven and let them coast into perfection on earth.""]","[""egg"", ""vanilla"", ""oats"", ""brown sugar"", ""corn flakes"", ""baking"", ""flour"", ""walnuts"", ""raisons"", ""coconut"", ""butter"", ""salt""]",www.epicurious.com/recipes/member/views/oatmeal-cookies-from-my-dad-50080014
Blueberry And Spice Smoothie,"[""Blend ice in a blender until crumbly; add yogurt, milk, blueberries, and cinnamon. Blend until smooth. Taste smoothie and add desired amount of sugar; blend.""]","[""low-fat milk"", ""frozen blueberries"", ""low-fat vanilla yogurt"", ""white sugar"", ""ground cinnamon""]",www.allrecipes.com/recipe/244942/blueberry-and-spice-smoothie/
Refrigerator Pickles,"[""Mix, boil, cool and add all ingredients to cucumbers."", ""Keep well in refrigerator.""]","[""sugar"", ""celery"", ""onions"", ""cucumber"", ""turmeric"", ""cider vinegar"", ""salt""]",www.cookbooks.com/Recipe-Details.aspx?id=620731
