title,directions,Ingridents,link
Chicory Salad With Creamy Garlic Dressing,"[""Place bread cubes in a bowl; drizzle oil over the bread cubes, tossing well. Arrange bread cubes in single layer on a baking sheet. Bake at 400\u00b0 for 8 minutes or until golden. Let cool."", ""Place cottage cheese in food processor, and process 2 minutes or until smooth, scraping sides of bowl once. Add the pepper and next 4 ingredients; process until well-blended. Spoon mixture into a bowl; set aside."", ""Combine the chicory, romaine, and bread cubes in a bowl; toss gently. Add dressing, toss gently to coat. Top with chopped egg.""]","[""red wine vinegar"", ""torn romaine lettuce"", ""pepper"", ""eggs"", ""cheese"", ""italian bread"", ""garlic"", ""mustard"", ""olive oil"", ""salt""]",www.myrecipes.com/recipe/chicory-salad-with-creamy-garlic-dressing
Basta,"[""Mill the peanuts."", ""Melt butter and sugar, and mix in peanuts."", ""Brush 1 sheet phyllo with a little melted butter."", ""Add small blobs of peanut mix over the top half of the phyllo pastry."", ""Roll up the pastry into a sausage, starting from the nut covered end."", ""Repeat with all sheets of phyllo."", ""Bake for 40 minitess in oven at 220\u00b0C on baking sheet."", ""Put sugar, water and lemon in pan and boil until becomes syrupy."", ""Cut pastries into 2cm pieces, but leave them lying in their strips."", ""Cover in the sugar syrup."", ""When cool transfer onto some newspaper to absorb excess liquid."", ""Eat and enjoy.""]","[""lemon juice"", ""brown sugar"", ""pastry"", ""caster sugar"", ""boiling water"", ""ghee"", ""peanuts""]",www.food.com/recipe/basta-252659
Quick Tomato Macaroni,"[""Melt margarine in saucepan, and saute onions until translucent."", ""Add soup, water and cheese."", ""Cook on low until cheese is melted."", ""Mix hot cooked macaroni with above mixture and pour into buttered casserole dish I use 9x9 square pan, but 1 1/2 quart dish is called for in recipe."", ""Mix dry bread crumbs with melted margarine, and top casserole off."", ""Bake at 350 F 30 minutes (or until lightly browned).""]","[""macaroni"", ""cheddar cheese"", ""onion"", ""tomato soup"", ""water"", ""breadcrumbs"", ""margarine""]",www.food.com/recipe/quick-tomato-macaroni-89589
Pepperoni Pizza Omelet,"[""In a small bowl beat together eggs, milk, and Italian seasonings until well blended."", ""In a skillet over medium heat, melt butter."", ""Add eggs; as the eggs set lift edges so the rest of the eggs can cook."", ""When eggs are partially set, spread pizza sauce on half of the eggs."", ""Cover sauce with mozzarella cheese; cover cheese with pepperoni."", ""Place other half of omelet over pepperoni."", ""Remove from heat and let sit for a couple of minutes or until cheese is slightly melted.""]","[""pizza sauce"", ""italian seasoning"", ""eggs"", ""mozzarella cheese"", ""milk"", ""butter"", ""pepperoni""]",www.food.com/recipe/pepperoni-pizza-omelet-255682
Baked Crab Mac-n-Cheese,"[""Preheat oven to 375F."", ""Set a large pot of water on to boil."", ""Cook pasta for about 5 minutes or until the outside is cooked but the inside is underdone."", ""Drain and rinse, set aside."", ""Meanwhile, tear your bread into pieces, place in a food processor and process make bread crumbs."", ""Melt 1 Tablespoon of butter and toss with breadcrumbs in a small bowl."", ""Add parsley, garlic powder, Parmesan and 1 teaspoon of kosher salt to the crumbs and set aside."", ""In a small bowl mix the milk and cream together, set aside."", ""In a medium saucepan over medium heat, melt the remaining butter."", ""Whisk in the flour and cook for 1 minute."", ""Slowly whisk in the milk and cream until the mixture is smooth."", ""Continue to cook and stir until milk has thickened enough to coat the back of a spoon."", ""(Hey!"", ""You just made a Bechamel sauce!!!)"", ""Remove from the heat and stir in cayenne, old bay, mustard, and 1 teaspoon salt."", ""Stir in cheese until it has all melted."", ""Taste and add salt if necessary."", ""In a large bowl, stir pasta, cheese sauce and crab meat together well."", ""Using the wrapper from the butter, grease the bottom and sides of a 1.5 quart casserole dish."", ""Pour the mac-n-cheese into the dish."", ""Sprinkle the breadcrumbs on top."", ""Bake for 20-30 minutes or until top is browned and mac-n-cheese is bubbly.""]","[""bread"", ""cayenne"", ""milk"", ""cheddar"", ""parmesan cheese"", ""bay seasoning"", ""all-purpose"", ""crab meat"", ""pasta shells"", ""fontina cheese"", ""parsley"", ""kosher salt"", ""light cream"", ""garlic"", ""ground mustard"", ""unsalted butter""]",tastykitchen.com/recipes/main-courses/baked-crab-mac-n-cheese/
Tiramisu Layer Cake,"[""Preheat oven to 350 degrees F (175 degrees C). Grease and flour 3 (9 inch) pans."", ""Prepare the cake mix according to package directions. Divide two thirds of batter between 2 pans. Stir instant coffee into remaining batter; pour into remaining pan."", ""Bake in the preheated oven for 20 to 25 minutes, or until a toothpick inserted into the center of the cake comes out clean. Let cool in pan for 10 minutes, then turn out onto a wire rack and cool completely. In a measuring cup, combine brewed coffee and 1 tablespoon coffee liqueur; set aside."", ""To make the filling: In a small bowl, using an electric mixer set on low speed, combine mascarpone, 1/2 cup confectioners' sugar and 2 tablespoons coffee liqueur; beat just until smooth. Cover with plastic wrap and refrigerate."", ""To make the frosting: In a medium bowl, using an electric mixer set on medium-high speed, beat the cream, 1/4 cup confectioners' sugar and 2 tablespoons coffee liqueur until stiff. Fold 1/2 cup of cream mixture into filling mixture."", ""To assemble the cake: Place one plain cake layer on a serving plate. Using a thin skewer, poke holes in cake, about 1 inch apart. Pour one third of reserved coffee mixture over cake, then spread with half of the filling mixture. Top with coffee-flavored cake layer; poke holes in cake. Pour another third of the coffee mixture over the second layer and spread with the remaining filling. Top with remaining cake layer; poke holes in cake. Pour remaining coffee mixture on top. Spread sides and top of cake with frosting. Place cocoa in a sieve and lightly dust top of cake. Garnish with chocolate curls. Refrigerate at least 30 minutes before serving."", ""To make the chocolate curls, use a vegetable peeler and run it down the edge of the chocolate bar.""]","[""confectioners"", ""sugar"", ""heavy cream"", ""coffee"", ""white cake"", ""chocolate"", ""cake"", ""cocoa"", ""mascarpone cheese"", ""coffee powder""]",www.allrecipes.com/recipe/25639/tiramisu-layer-cake/
Vegetable Lasagna,"[""Cook noodles; drain and set aside."", ""Mix eggs, cottage and Ricotta cheese and seasoning."", ""Set aside."", ""Cook mushrooms, onions and garlic in butter until tender."", ""Stir in flour and pepper, then add milk."", ""Cook and stir until thick and bubbly."", ""Remove from heat and stir in spinach or broccoli, carrots and 1/2 cup Parmesan cheese."", ""In a 9 x 13-inch pan, layer 1/3 of noodles."", ""Spread 1/3 of cheese mixture over, then 1/3 of vegetable mixture."", ""Sprinkle with Mozzarella cheese."", ""Repeat these steps 2 more times."", ""Sprinkle with remaining Parmesan cheese."", ""Bake at 350\u00b0 for 35 minutes, covered."", ""This can also be made ahead of time and placed in the freezer until needed.""]","[""pepper"", ""italian seasoning"", ""milk"", ""noodles"", ""eggs"", ""parmesan cheese"", ""mozzarella cheese"", ""mushrooms"", ""onion"", ""flour"", ""clove garlic"", ""broccoli"", ""cottage cheese"", ""ricotta cheese"", ""carrot"", ""butter""]",www.cookbooks.com/Recipe-Details.aspx?id=1027955
Split Pea 'N Ham Soup,"[""Put all ingredients and 6 1/2 cups water in a 5 1/2-quart slow cooker."", ""Cover and cook on high for 6 hours, or low for 12 hours until peas are very soft and fall apart."", ""Remove ham."", ""When cool enough to handle, cut meat off the bone, dice and return to soup.""]","[""peas"", ""pepper"", ""ham hocks"", ""onion"", ""celery"", ""carrots"", ""salt""]",www.food.com/recipe/split-pea-n-ham-soup-112831
Spotted Dick,"[""Have ready a sheet of foil or a double thickness of greaseproof paper brushed with melted margarine."", ""Make the pudding crust: Sieve the flour and the salt."", ""Rub in the margarine."", ""Add the sugar and sultanas."", ""Mix in the water to make a soft dough."", ""Turn out onto a floured board and form into a roll."", ""Wrap loosely but securely in the greaseproof paper or foil. Tie or seal the ends."", ""Place in the steamer and cover tightly."", ""Steam for 1.1/2 to 2 hours."", ""Serve with hot custard sauce or sprinkle with castor sugar."", ""Variation: At stage 3: Put the mixture in a medium-sized (1.1/2 pint) pudding basin""]","[""sugar"", ""raisins"", ""water"", ""flour"", ""margarine"", ""salt""]",www.yummly.com/recipe/Spotted-Dick-1671365
Jerk Jackfruit Tacos,"[""Drain the jackfruit in a colander."", ""In a wide bowl, use a fork to pull the fibers apart. The jackfruit should have a texture reminiscent of pulled chicken."", ""Place the jackfruit and chopped red pepper in a large pot or skillet with a lid, and set aside."", ""Place the sauce ingredients (onion to bouillon) in a blender, and blend until it has become a smooth liquid."", ""Pour the sauce over the jackfruit, and stir to coat."", ""Place the pot on the stove, and bring contents to a simmer. Reduce heat to medium-low, cover the pot, and cook for 30 minutes."", ""While the jerk jackfruit is cooking, make your mango guacamole."", ""Place the guacamole ingredients in a mortar and pestle (or bowl and fork) and mash until your desired texture is reached. I like mine with some chunks in it. Set aside."", ""Serve the jerk jackfruit inside of warmed corn tortillas and topped with mango guacamole.""]","[""red bell peppers"", ""lime juice"", ""mangoes"", ""ginger"", ""coconut nectar"", ""fresh thyme"", ""nutmeg"", ""vegetable stock"", ""avocados"", ""mango"", ""green onions"", ""cilantro"", ""yellow onion"", ""apple cider vinegar"", ""ground allspice"", ""salt"", ""pepper"", ""black pepper"", ""garlic"", ""green jackfruit"", ""shoyu"", ""corn tortillas"", ""red onion""]",www.food.com/recipe/jerk-jackfruit-tacos-531877
Tuna Salad,"[""Brush the tuna steaks with olive oil, and sprinkle with salt and pepper. Place the tuna steaks in a very hot saute pan and cook for only 1 minute on each side. Set aside on a platter."", ""Meanwhile, in a small bowl, combine the olive oil, salt, pepper, lime zest, wasabi, lime juice, soy sauce and hot sauce. Add the avocados to the vinaigrette."", ""Cut the tuna in chunks and place it in a large bowl. Add the scallions and red onion and mix well. Pour the vinaigrette mixture over the tuna and carefully mix.""]","[""wasabi powder"", ""soy sauce"", ""tuna"", ""scallion"", ""avocado"", ""freshly squeezed lime juice"", ""fresh coarse ground black pepper"", ""kosher salt"", ""red onion"", ""olive oil"", ""hot sauce""]",www.food.com/recipe/tuna-salad-157052
Peanut Butter Balls,"[""Combine sugar and peanut butter; add margarine."", ""Make into small balls."", ""Place on wax paper and chill for 1 hour."", ""Melt chocolate and wax together."", ""Dip balls with a toothpick into chocolate mixture."", ""Place back on wax paper."", ""Remove toothpick and with a spoon cover hole with chocolate.""]","[""paraffin"", ""peanut butter"", ""margarine"", ""confectioners sugar"", ""chocolate chips""]",www.cookbooks.com/Recipe-Details.aspx?id=1024771
Taco Soup,"[""Brown ground beef and chopped onions with Taco Seasoning in a pot."", ""Drain off fat from browned ground beef."", ""Add all other ingredients."", ""If you want the soup more like a chili consistency then drain off the kidney beans, diced tomatoes and whole kernel corn before adding them to the pot."", ""Bring to a boil."", ""Reduce heat and simmer for 20-30 minutes.""]","[""green chilies"", ""kidney beans"", ""tomatoes"", ""chili beans"", ""taco"", ""lean ground beef"", ""water"", ""onions"", ""beans"", ""whole kernel corn""]",www.food.com/recipe/taco-soup-432152
Okra-Stuffed Chikuwa - For Bentos,"[""Boil the okra."", ""The preparation can be found in."", ""Cool the okra, then stuff into the chikuwa hole."", ""Cut the chikuwa into four pieces, then pack in a bento."", ""Beef-Wrapped Green Beans"", ""Jabara Cucumber Namul""]","[""chikuwa"", ""salt""]",cookpad.com/us/recipes/150828-okra-stuffed-chikuwa-for-bentos
Taco Salad,"[""Fry ground chuck; drain off grease, then add taco seasoning mix and prepare according to instructions on taco mix. Set aside and let cool. Cut up lettuce, tomatoes and green onions and place in large bowl. Rinse and drain pinto beans, then place in large bowl. Then add all other ingredients and toss. Do not add ground chuck, taco chips, Green Goddess dressing, Cheddar cheese and taco sauce until right before serving.""]","[""head lettuce"", ""tomatoes"", ""taco chips"", ""dressing"", ""green onions"", ""cheddar cheese"", ""ground chuck"", ""taco sauce"", ""taco seasoning mix"", ""pinto beans""]",www.cookbooks.com/Recipe-Details.aspx?id=97224
Pineapple Chicken Burritos ,"[""1.Place the chicken (may be fresh or frozen), pineapple, beans, and salsa in a gallon size ziplog freezer bag. Zip close and place in freezer. When ready to use thaw in fridge for 24 hours."", ""2.Cook on low for 6 to 8 hours. Remove the chicken and shred. Mix the chicken back into the crock pot with the rest of the ingredients."", ""3.Mix in the cooked rice."", ""4.Fill 5-6 of the burrito tortillas. Place in in a 9x13 pan. Pour 1 can of the green enchilada sauce over the burritos."", ""5.Top with 1 cup of the shredded cheese and place under the broiler on the middle rack until the cheese is nice and melted. About 5 minutes.""]","[""black beans"", ""chicken breasts"", ""flour tortillas"", ""salsa"", ""green enchilada sauce"", ""rice"", ""cheddar/"", ""pineapple""]",www.epicurious.com/recipes/member/views/pineapple-chicken-burritos-52622561
Sour Cream Pound Cake,"[""Cream sugar and margarine at medium speed on electric mixer until combined."", ""Gradually add egg substitute, beating well. Combine flour and salt with mixture running at low speed."", ""Add to creamed mixture, alternately with sour cream mixture, beginning and ending with flour mixture."", ""Stir in vanilla."", ""Spoon batter into a 10-inch tube pan coated with cooking spray."", ""Bake at 325\u00b0 for 1 hour, or until a wooden pick inserted in center comes clean. Cool 10 minutes; remove from pan.""]","[""cake flour"", ""frozen egg substitute"", ""sugar"", ""baking powder"", ""vanilla"", ""margarine"", ""low-fat sour cream"", ""salt""]",www.cookbooks.com/Recipe-Details.aspx?id=738636
Glazed Turkey Chops,"[""For the chops, in deep glass dish large enough to hold all the chops, combine all ingredients but the chops and oil."", ""Add 6 cups boiling water, mix well, and cool."", ""Add chops to cooled brine, cover, and refrigerate for 48 hours."", ""For the glaze, combine all ingredients but butter in saucepan, and bring to boil over medium-high heat."", ""Cook until mixture reduces to almost a syrupy consistency, for 20 to 25 minutes."", ""Set aside."", ""Prepare grill, indoors or out."", ""Remove chops from brine; dry with paper towels."", ""Bring brine to boil in saucepan; set aside."", ""Brush chops generously with oil."", ""Sear on both sides on grill, and then cook away from hottest part of grill, turning to cook both sides."", ""Brush chops often with brine to keep moist."", ""Cook for 15 to 20 minutes, or until all the pink is gone."", ""Just before the chops are cooked, warm the glaze slightly; whisk in the butter."", ""Brush over the chops; serve with cranberry relish or compote.""]","[""coarse salt"", ""peppercorns"", ""ginger"", ""mustard seeds"", ""shallot"", ""molasses"", ""onion"", ""turkey chops"", ""bay leaves"", ""balsamic vinegar"", ""maple syrup"", ""oranges"", ""garlic"", ""chicken"", ""olive oil"", ""unsalted butter""]",cooking.nytimes.com/recipes/349
Cheddar-Parmesan Chicken Bake,"[""Heat oven to 350F."", ""Mix chicken, soup, water chestnuts, spaghetti, 1/2 cup cheddar, 1/2 cup Parmesan and milk."", ""Spoon into 1-1/2-qt."", ""casserole."", ""Bake 45 min."", ""Top with remaining cheeses."", ""Bake 5 min."", ""or until cheese is melted.""]","[""condensed cream"", ""water chestnuts"", ""cheddar cheese"", ""parmesan cheese"", ""milk""]",www.kraftrecipes.com/recipes/cheddar-parmesan-chicken-bake-156444.aspx
Deep Dish Chicken-Vegetable Pie,"[""Place vegetables in a boiler and add chicken broth."", ""Cover and simmer for about 20 minutes or until vegetables are tender."", ""Stir in half and half and poultry seasoning."", ""In a small bowl mix margarine and flour into a paste."", ""Drop lump of paste into sauce. Stir over low heat until flour paste melts and sauce thickens. Season sauce to taste with salt and pepper."", ""Cut chicken into large pieces."", ""Stir chicken into sauce."", ""Pour mixture into 2 or 3-quart casserole."", ""Place crust over filling all the way to the edge of casserole dish."", ""Prick top to allow steam to escape."", ""Bake in 400\u00b0 oven for 20 to 25 minutes or until golden brown."", ""Serves 6 to 8.""]","[""potatoes"", ""favorite recipe"", ""celery"", ""flour"", ""poultry seasoning"", ""chicken broth"", ""carrots"", ""margarine"", ""chicken""]",www.cookbooks.com/Recipe-Details.aspx?id=327082
Cheese Apple Crisp,"[""Arrange apples in a greased baking dish."", ""Add water and lemon juice."", ""Mix water and lemon juice."", ""Mix sugar, cinnamon, flour and salt."", ""Work in butter to form a crumbly mixture."", ""Add grated cheese to crumbly mixture."", ""Spread the mixture over the apples and bake in a moderate oven (350\u00b0) until apples are tender and crust is crisp.""]","[""sugar"", ""lemon juice"", ""cinnamon"", ""water"", ""flour"", ""apples"", ""grated cheese"", ""butter"", ""salt""]",www.cookbooks.com/Recipe-Details.aspx?id=178415
Chicken Cacciatore,"[""In large frypan, heat 2 tablespoons oil."", ""Add the chicken pieces, sprinkling garlic powder over the chicken."", ""Saute 10 to 15 minutes or until chicken is lightly browned.""]","[""spaghetti"", ""fresh mushrooms"", ""chicken breast"", ""onions"", ""spaghetti sauce"", ""garlic"", ""olive oil""]",www.cookbooks.com/Recipe-Details.aspx?id=881524
Herbed Onion Bread,"[""In bread machine pan, place all ingredients in order suggest by manufacturer. Select basic bread setting. Choose crust color and loaf size if available. Bake according to bread machine directions (check dough after 5 minutes of mixing; add 1 to 2 tablespoons of water or flour if needed).""]","[""bread flour"", ""nonfat dry milk"", ""poppy seeds"", ""sugar"", ""dill weed"", ""active dry yeast"", ""onion"", ""water"", ""butter"", ""salt""]",www.tasteofhome.com/recipes/herbed-onion-bread/
Cucumber Gin Spritzers,"[""Mix gin, Roses Lime juice, lime juice and sliced cucumbers together."", ""Divide among 6 ice filled glasses (I'll use rocks glasses)."", ""Top with ginger ale."", ""Add lime slices for garnish.""]","[""lime juice"", ""ginger ale"", ""lime"", ""persian cucumber"", ""gin""]",www.food.com/recipe/cucumber-gin-spritzers-498188
Salted Cod  À La Brás (Bacalhau À La Brás),"[""Rinse fish with cold water; place, skin side up, in a shallow baking dish. Cover with water to 1/4 inch above fish. Cover and chill 24 hours, changing water 4 times."", ""Drain fish. Place fish in a large saucepan; cover with water. Bring to a boil, reduce heat to medium-low, and simmer 12 to 15 minutes or until fish begins to flake apart. Drain. Flake fish into bite-sized pieces with a fork."", ""While fish cooks, place potato sticks in a large bowl. Cover with cold water to 1 inch above potatoes; let stand 30 minutes to draw out starch. Drain and pat dry with paper towels."", ""Heat a large nonstick skillet over medium-high heat. Add 2 tablespoons oil to pan; swirl to coat. Add half of potatoes; cook 5 minutes or until golden brown. Remove potatoes from pan; drain on paper towels. Add 1 tablespoon oil to pan; swirl to coat. Repeat procedure with remaining potatoes. Reduce heat to medium."", ""Add 1 1/2 teaspoons oil to pan; swirl to coat. Add onion, saffron, and garlic; saute 6 to 8 minutes or until onion is golden brown. Add remaining 1 1/2 teaspoons oil and fish; cook 3 minutes, stirring occasionally. Add potatoes; cook 2 minutes."", ""Combine eggs, salt, and pepper in a large bowl; stir well with a whisk. Pour eggs over potato mixture, and cook 3 minutes or until eggs are soft-scrambled, stirring occasionally. Sprinkle with olives and parsley."", ""Salted Cod Before refrigeration, salting cod helped preserve the fish. Lower-quality salted cod comes from thinner fillets and tends be so dried out that it lacks flavor. Look for salted cod that's about 1/2-inch thick, preferably from the loin section, and at least a little pliable. To remove the salt and rehydrate the fish, soak it in cold water for a day or two, changing the water three to four times a day (change the water more often if you soak the fish for less time).""]","[""cod loin"", ""eggs"", ""onion"", ""saffron threads"", ""oil-cured"", ""ground black pepper"", ""parsley"", ""garlic"", ""baking potatoes"", ""olive oil"", ""salt""]",www.myrecipes.com/recipe/salted-cod-al-a-bras
Zippy Pickled Eggs,"[""Clean 5-6 large sealer jars with lids."", ""Put everything (except the eggs) in a large pot. Bring to a boil and simmer for about 20 minutes."", ""To hard-boil the eggs:."", ""I recommend bringing the eggs to room temperature first. Put them in a single layer in a large pot, and cover with water."", ""Bring the water to a rolling boil, then turn off the heat and cover with a lid."", ""Take pot off the heat after 1 minute, and let sit for 17 minutes."", ""Plunge eggs into a cold water bath to halt the cooking process."", ""Once cooled, peel the eggs (give them a smack with a spoon to make peeling easier)."", ""Fill all jars with boiling water."", ""Boil jar lids in a pot for at least 5 minutes."", ""Dump out the boiling water and layer the jars alternately with the pepper sauce and eggs."", ""Keep the lids boiling in the water. Take one out and immediately put it on a jar. This should create a seal. Make sure the lid \""pops\"" down onto the jar."", ""Store the jars in a fridge. The eggs should be well flavoured in about 3 weeks. Full saturation will take over a month.""]","[""well"", ""white sugar"", ""mustard seeds"", ""tabasco sauce"", ""eggs"", ""onion"", ""water"", ""white vinegar"", ""fresh scotchbonnet bell peppers"", ""handful dried"", ""dill"", ""peppercorn"", ""jalapeno peppers"", ""garlic"", ""salt""]",www.food.com/recipe/zippy-pickled-eggs-362228
Spectacular Spaghetti Squash Saute,"[""Preheat oven to 350 degrees."", ""Bake whole squash 1 hour or until tender when pierced with fork."", ""Remove from oven and allow to cool 5-10 minutes."", ""Halve lengthwise and remove seeds."", ""With fork, pull out spaghetti-like strands and place in large serving bowl."", ""Set aside."", ""In large skillet, heat olive oil and butter over medium heat."", ""Add mushrooms, tomatoes, zucchini, green onions, garlic, bell pepper, and snow peas."", ""Cook until soft (4-5 minutes)."", ""Pour over squash and toss to combine."", ""Sprinkle with Parmesan and serve immediately.""]","[""tomatoes"", ""green onions"", ""parmesan cheese"", ""mushrooms"", ""red bell pepper"", ""olive oil"", ""snow"", ""garlic"", ""butter"", ""zucchini""]",www.food.com/recipe/spectacular-spaghetti-squash-saute-43346
Sugar Cookies,"[""Cream the shortening, sugar and vanilla."", ""Add egg and milk. Beat until light and fluffy."", ""Sift flour, baking powder and salt together."", ""Fold in creamed mixture."", ""Divide into 1/2 and chill for at least 1 hour."", ""Roll out and use cookie cutters or just use spoonfuls."", ""Bake at 350\u00b0 for 8 to 10 minutes."", ""Enjoy plain or with Buttercream Icing."", ""Yields 3 dozen.""]","[""egg"", ""sugar"", ""vanilla"", ""baking powder"", ""shortening"", ""flour"", ""milk"", ""salt""]",www.cookbooks.com/Recipe-Details.aspx?id=956475
Ham Biscuits,"[""Preheat oven to 350\u00b0."", ""Melt butter and mix in next 4 ingredients."", ""Place one ham slice and one cheese slice in each roll."", ""Pour butter mixture over rolls."", ""Cover with foil and bake at 350\u00b0 for 15 minutes""]","[""rolls"", ""ham sliced"", ""poppy seed"", ""swiss cheese"", ""onion flakes"", ""mustard"", ""butter"", ""worcestershire sauce""]",www.cookbooks.com/Recipe-Details.aspx?id=349931
Laurie Davis' Chicken Tetrazzini,"[""Cook chicken until tender."", ""Cool, bone and cut in small pieces. Cook spaghetti until tender and rinse in cold water."", ""Cook green pepper 5 minutes in a little chicken broth."", ""Put a layer of chicken in bottom of greased dish, then a bit of pepper, pimento, mushrooms and 1 can of soup."", ""Then add a layer of spaghetti; sprinkle with onion salt and layer of grated cheese."", ""Make second layer, putting chicken, pepper, pimentos, mushrooms and soup."", ""Put the second layer of spaghetti; sprinkle with onion salt and a thick layer of cheese (grated)."", ""Top with bread or cracker crumbs and a few pieces of butter."", ""Bake 45 minutes in 350\u00b0 oven."", ""This may be frozen. This may not be so simple, but it sure is good, especially for a family gathering or church supper.""]","[""spaghetti"", ""bread"", ""mushroom pieces"", ""mushroom soup"", ""fryer"", ""pimentos"", ""grated cheese"", ""green pepper""]",www.cookbooks.com/Recipe-Details.aspx?id=443576
