title,directions,Ingridents,link
Beefy Noodle Bake,"[""Cook pasta and drain."", ""Set aside."", ""In a skillet, cook beef and onion until meat is done, seasoning with salt and pepper to taste."", ""Drain meat and return to skillet (do not return to heat)."", ""Stir in tomato sauce, sour cream, cream cheese, sugar and garlic powder."", ""Mix until blended."", ""Place half of the cooked noodles in a greased 9 x 13 baking dish; top with half of beef mixture."", ""Sprinkle cheddar cheese on top of beef mixture."", ""Repeat layers."", ""Cover and bake at 350 degrees for 30 - 35 minutes or until heated through.""]","[""sour cream"", ""sugar"", ""cheddar cheese"", ""cream cheese"", ""onions"", ""ground beef"", ""garlic"", ""pasta"", ""tomato sauce""]",www.food.com/recipe/beefy-noodle-bake-152855
Aztec Torte Recipe,"[""Preheat the oven to 425deg.. Cut a circle of baker's parchment or possibly waxed paper to line the bottom of the cake pan or possibly springform."", ""Butter the bottom and sides of the pan, then insert the paper and butter it also."", ""If using the springform, wrap the outside of the pan with tinfoil to make it watertight."", ""Heat the chocolate and butter in the top of a double boiler over gently simmering water."", ""Remove from the heat, whisk till smooth, then whisk in the peanut butter and chile puree."", ""In a mixing bowl, beat the Large eggs till they are light and have increased in volume, two to three min."", ""Carefully fold the Large eggs into the chocolate mix in three batches till no streaks of egg are visible."", ""Pour the batter into the prepared pan and smooth the top."", ""Pour about one inch of warm water into a larger baking pan and set the cake pan or possibly springform in it."", ""Place the pans in the middle rack of the oven and bake for 15 min."", ""Remove from the oven and set the torte on a rack to cold."", ""Sprinkle the minced peanuts on the top of the torte, pressing very gently so they will adhere."", ""When the torte has cooled, cover and chill at least four hrs or possibly overnight."", ""To unmold, dip a sharp knife into warm water, dry it, and run it around the edge of the torte pan."", ""Immerse the base of the pan in warm water for a few seconds, dry it well, then turn it out onto a serving plate so which the minced nuts become the crust."", ""Presentation: I cut a chile pepper stencil out of parchment, place it on top, and dust it with powdered sugar or possibly cocoa."", ""Serve plain, with shortbread cookies or possibly sweetened whipped cream."", ""Yields eight generous servings""]","[""smooth peanut butter"", ""honey"", ""eggs"", ""chocolate"", ""chile puree"", ""butter""]",cookeatshare.com/recipes/aztec-torte-72680
Grape-Nuts Pudding,"[""Heat milk over medium heat until bubbles form around pan. Then watch for milk to rise."", ""When milk rises about 1/8 of an inch and foam appears on top, take milk off heat."", ""Let cool."", ""Beat eggs, vanilla and salt, then sugar."", ""Blend into milk."", ""Then add Grape-Nuts and raisins."", ""Pour into glass pan and sprinkle nutmeg on top."", ""Sit glass pan inside pan with water 1/3 full."", ""Bake in 350\u00b0 oven for 1 hour.""]","[""sugar"", ""vanilla"", ""nutmeg"", ""eggs"", ""raisins"", ""milk"", ""grape-nuts"", ""salt""]",www.cookbooks.com/Recipe-Details.aspx?id=579702
3 Layer Pie,"[""Press flour, butter and pecans in the bottom of the pan and brown in oven at 350\u00b0."", ""Let this cool."", ""Mix powdered sugar, 1 to 2 cups"", ""Cool Whip and cream cheese; spread on crust."", ""Mix chocolate pudding, vanilla pudding and milk; put on top of layer No. 2."", ""Put Cool Whip on top."", ""Keep in refrigerator.""]","[""instant vanilla pudding"", ""powdered sugar"", ""instant chocolate pudding"", ""pecans"", ""cream cheese"", ""flour"", ""milk"", ""butter""]",www.cookbooks.com/Recipe-Details.aspx?id=654545
Tomato Sauce for Spaghetti and Meatballs,"[""In a saucepan heat oil."", ""Add onion and saute until transparent."", ""Then add garlic, tomatoes with their juices, salt, hot pepper, and pinch of sugar."", ""Cook, uncovered, for 20 minutes."", ""Season to taste, and puree in a food mill."", ""Return to the saucepan, add meatballs to reheat them slightly and serve atop your spaghetti.""]","[""sugar"", ""italian plum tomatoes"", ""onion"", ""clove garlic"", ""olive oil"", ""salt""]",www.foodnetwork.com/recipes/tomato-sauce-for-spaghetti-and-meatballs-recipe.html
Beet-Pickled Deviled Eggs,"[""Equipment: an electric coffee/spice grinder or a mortar and pestle."", ""Bring water, vinegar, beet, shallot, sugar, bay leaf, and 1/2 teaspoon salt to a boil in a 2-quart saucepan, then simmer, covered, until beet is tender, about 20 minutes. Cool completely, uncovered. Put beet mixture in a container with eggs and marinate, chilled, gently stirring once or twice, at least 2 hours."", ""Finely grind caraway seeds in grinder."", ""Remove eggs from beet mixture and pat dry (discard beet mixture). Cut in half lengthwise and remove yolks. Mash yolks with mayonnaise, mustard, parsley, and half of caraway. Season with salt and pepper, then divide among egg whites. Sprinkle with remaining caraway."", ""Cooks' notes: Eggs can be marinated, chilled, in an airtight container up to 3 days."", ""Eggs can be filled 2 hours ahead and chilled, loosely covered.""]","[""beet"", ""sugar"", ""eggs"", ""white vinegar"", ""water"", ""mayonnaise"", ""caraway"", ""flat leaf parsley"", ""bay leaf"", ""shallot"", ""grainy mustard""]",www.food.com/recipe/beet-pickled-deviled-eggs-397965
Easy-Peasy Peanut Butter Cookies,"[""Preheat oven to 350 F. In a medium bowl whisk egg, sugar and vanilla until well combined. Using a rubber spatula, stir in the peanut butter (I used creamy) and when it comes together you'll have a thick dough. Stir in the Reese's Pieces or chocolate chips, if using."", ""Using a small cookie scoop, scoop dough onto cookie sheet. Gently press down on tops of balls to flatten. The cookies won't spread much so you can place them 1-2 inches apart."", ""Bake for 10-12 minutes, or until edges are slightly browning. Remove from oven. Move cookies to a cooling rack to cool completely. Cookies will be very dense and very rich. Makes 18-24 cookies depending on your scoop size and whether or not you use any add-ins."", ""Other options:"", ""1. Substitute mini chocolate chips or mini peanut butter cups for the Reese's Pieces (I've done both and they're delicious) or omit add-ins completely."", ""2. You may roll dough balls in extra granulated sugar then continue with recipe by pressing gently on dough to flatten and bake as instructed.""]","[""egg"", ""sugar"", ""vanilla"", ""peanut butter"", ""chocolate chips""]",tastykitchen.com/recipes/desserts/easy-peasy-peanut-butter-cookies/
Easy Chilaquiles,"[""Heat up the oil in a skillet. Cut the tortillas into medium size pieces, either triangle shaped or whatever shape you fancy, and fry in the oil."", ""When tortillas are almost fried (or hard), add the green onions and continue to cook."", ""Add the bouillon, stirring the tortillas, and add the tomato sauce, stirring until everything is covered with the sauce (you might need the whole can)."", ""Crumble the cheese on top, turn off the heat and cover the skillet for about 1-2 minutes."", ""To serve, add some of the cream on top."", ""** If you don't have Mexican cream at your local market, you can use regular sour cream, it tastes good, too!""]","[""oil"", ""cotija cheese"", ""chicken bouillon"", ""sour cream"", ""green onions"", ""corn tortillas"", ""tomato sauce""]",www.food.com/recipe/easy-chilaquiles-259962
Freezer Fruit Cake,"[""Melt marshmallows in cream over low heat."", ""Mix raisins, pineapple, cracker crumbs, cherries, coconut and English walnuts. Mix well in large bowl."", ""Pour milk and melted marshmallows over the six ingredients and mix well."", ""Mold into a Bundt pan."", ""Press firmly and freeze for 30 days."", ""Let thaw in Kelvinator for 2 days before serving.""]","[""marshmallows"", ""pet milk"", ""raisins"", ""dates"", ""red candied cherries"", ""coconut"", ""walnuts"", ""graham crackers"", ""pineapple""]",www.cookbooks.com/Recipe-Details.aspx?id=278507
Pizza Muhammara,"[""Preheat the oven to 230 deg C/475 deg F and set a baking stone (if you have one) onto a rack at the lowest rung of your oven. If you don't have a pizza stone, use a regular baking tray, turned upside down. Alternatively, put on your grill"", ""Using a pastry brush/spatula, spread the pita or lavash with the Muhammara, and drizzle with pomegranate molasses."", ""Tear the mozzarella into pieces and scatter over the Muhammara. Finish off with the tomato berries or quartered cherry tomatoes and drizzle with the dried oregano olive oil"", ""Place in the oven or on the grill and cook for 8-10 minutes, or until the cheese is melted."", ""Serve with a glass of mint tea!"", ""Put the bread, walnuts, red peppers, garlic, paprika, chili, and cumin seeds in a food processor. Pulse, till the mixture breaks down, scooping the sides in."", ""Follow with the pomegranate molasses, olive oil and lemon juice. If you feel you need more than what is specified in the recipe, by all means modify."", ""Taste and season with salt to ensure you have a tasty dip."", ""Store for up to a week in the refrigerator""]","[""pizza muhammara"", ""tomato"", ""oregano"", ""pita round"", ""pepper"", ""lemon juice"", ""mozzarella cheese"", ""molasses"", ""pomegranate molasses"", ""cumin seeds"", ""red paprikas"", ""paprika"", ""walnuts"", ""wholegrain bread"", ""garlic"", ""olive oil"", ""salt""]",food52.com/recipes/4391-pizza-muhammara
Mandarin Shrimp,"[""Heat oil in a frying pan and saute shrimp about 3 minutes, until pink."", ""Remove from the pan and set aside."", ""Add garlic to the pan and saute a minute or two."", ""Add mushrooms, sauteing 2 minutes longer."", ""Add water chestnuts, bouillon cube, 1 cup water and ginger."", ""Simmer 10 minutes."", ""Make a paste of cornstarch and water. Add soy sauce and pour into the pan."", ""Return the shrimp to the pan and heat until nicely thickened."", ""Serve over rice."", ""Sprinkle with green onion."", ""Serves 4.""]","[""oil"", ""soy sauce"", ""water chestnuts"", ""green onion"", ""fresh mushrooms"", ""water"", ""clove garlic"", ""cornstarch"", ""ground ginger"", ""rice"", ""shrimp"", ""chicken""]",www.cookbooks.com/Recipe-Details.aspx?id=857648
Hot Seafood Spread,"[""Beat cream cheese until smooth (1 to 2 minutes)."", ""Blend in remaining ingredients, except almonds and paprika."", ""Spread mixture in a 9-inch pie plate."", ""Top with almonds and sprinkle with paprika. Bake, uncovered, at 375\u00b0 for 20 minutes."", ""Serve with crackers or veggies.""]","[""horseradish sauce"", ""green onions"", ""crab flakes"", ""cream cheese"", ""paprika"", ""almonds""]",www.cookbooks.com/Recipe-Details.aspx?id=746139
Tortilla Roll Ups,"[""In a mixing bowl beat softened cream cheese and ranch dressing mix until smooth."", ""Add red pepper, celery, onions, and olives (if using), mix well."", ""Spread about 3/4 cups on each tortilla."", ""Place slices of the deli meat on top of the cream cheese mixture."", ""Roll up tightly and wrap in plastic wrap."", ""Refrigerate for at least 2 hours."", ""Slice into 1/2 inch pieces.""]","[""olive"", ""flour tortillas"", ""green onion"", ""cream cheese"", ""celery"", ""red bell pepper"", ""deli turkey""]",www.food.com/recipe/tortilla-roll-ups-30644
Esta Loca Margarita,"[""Combine all ingredients, except lime, in a pitcher."", ""Stir."", ""Pour into a margarita glass and garnish with lime wedge."", ""Can also be served on the rocks.""]","[""sweet"", ""pomegranate juice"", ""orange tequila"", ""orange liqueur""]",www.foodnetwork.com/recipes/sandra-lee/esta-loca-margarita-recipe.html
Shortcut Pepper Steak,"[""* Note that it takes about 15-20 minutes to cook this dish, once all of the veggies and beef has been prepped."", ""So try to time your rice so that it's ready to eat at the same time."", ""Prepare rice according to directions."", ""In skillet/wok, over medium-high heat, stir fry peppers, onion, and garlic in 1 Tbsp of hot vegetable oil until tender/crisp."", ""Remove and set aside."", ""In same skillet, stir fry HALF of beef strips in remaining 1 Tbsp hot vegatable oil until browned."", ""Remove and set aside."", ""Repeat with remaining beef."", ""In same skillet, combine soup, soy sauce, and ginger."", ""Mix well."", ""You can opt to adjust the soy sauce and ginger to suit your taste."", ""Or you can substitute a Tbsp of oyster sauce and 1 teaspoon fresh, grated ginger."", ""Return veggies and beef to skillet and heat through, stirring occasionally."", ""Serve over bed of hot, cooked rice."", ""* I've also made this using frozen peppers and/or onions."", ""Although you can't beat fresh veggies, it really doesn't affect the flavor much."", ""*** Recipe originates from Campbell's \""Fabulous One-Dish Recipes\"" cookbook (1992) ***""]","[""campbell's beefy mushroom soup"", ""soy sauce"", ""beef sirloin"", ""white rice"", ""green"", ""onion"", ""clove garlic"", ""ground ginger"", ""vegetable oil""]",cookpad.com/us/recipes/353182-shortcut-pepper-steak
Scalloped Potatoes,"[""Stir soup, milk and pepper until smooth."", ""In buttered 1 1/2-quart casserole, alternate layers of potatoes,"", ""onion, soup mixture and cheese."", ""Dot top with margarine."", ""Sprinkle with paprika."", ""Cover and bake at 375\u00b0 for 1 hour."", ""Uncover and bake for 15 minutes longer.""]","[""potatoes"", ""pepper"", ""cream of mushroom soup"", ""onion"", ""shredded cheese"", ""margarine"", ""milk"", ""paprika""]",www.cookbooks.com/Recipe-Details.aspx?id=408088
Savory Diet Chicken,"[""Preheat oven to 350 degrees F (175 degrees C)."", ""In a 9x13 inch baking dish, place the chicken breasts. Add the potatoes, bell peppers, carrot and onion, all cubed or quartered. Sprinkle all liberally with Worcestershire sauce and a dash of paprika. Cover dish and bake in the preheated oven for 1 1/2 hour. That's it! Enjoy!""]","[""potatoes"", ""green bell peppers"", ""onions"", ""carrots"", ""skinless"", ""paprika"", ""worcestershire sauce""]",www.allrecipes.com/recipe/15207/savory-diet-chicken/
Polenta,"[""Combine cornmeal, cold water and salt."", ""Stir into boiling water."", ""Stir constantly over low heat for 15 minutes."", ""Add 2 tablespoons butter and stir."", ""Stir until thickens."", ""Spread on polenta board or on individual plates."", ""Sprinkle each serving with melted butter (optional) and Parmesan cheese."", ""Spread on sauce and more cheese."", ""Grab your fork, mark off your area and enjoy.""]","[""parmesan cheese"", ""cold water"", ""cornmeal"", ""boiling water"", ""butter"", ""salt""]",www.cookbooks.com/Recipe-Details.aspx?id=691587
Old Fashioned Tea Cakes,"[""Preheat oven to 350F and lightly grease baking sheet."", ""Cream butter and sugar together; add orange rind, juice and egg."", ""Beat thoroughly."", ""Sift flour, baking powder and salt together; add to mixture and mix thoroughly."", ""Place on a floured board and roll thinly."", ""Cut with a large round, scalloped cookie cutter."", ""Place on prepared baking sheet, sprinkle with sugar and bake for about 12 minutes or until golden.""]","[""egg"", ""sugar"", ""baking powder"", ""flour"", ""orange"", ""butter"", ""salt""]",www.food.com/recipe/old-fashioned-tea-cakes-271151
Dump Cake,"[""Empty can of pineapple with juice in a 9 x 13-inch ungreased pan."", ""Spread pie filling over pineapple."", ""Sprinkle dry cake mix over pie filling."", ""Sprinkle chopped nuts over cake mix. Generously dot with margarine."", ""Never stir mixture."", ""Bake at 350\u00b0 for 45 to 60 minutes until top is brown.""]","[""nuts"", ""margarine"", ""yellow cake mix"", ""pie filling"", ""pineapple""]",www.cookbooks.com/Recipe-Details.aspx?id=458485
Porcupines,"[""Mix all ingredients, except tomatoes, and form into balls. Brown in skillet."", ""Add tomato sauce."", ""Cover and cook at low temperature until rice is done (about 1 1/2 hours).""]","[""egg"", ""onion"", ""milk"", ""rice"", ""ground beef"", ""tomato sauce"", ""salt""]",www.cookbooks.com/Recipe-Details.aspx?id=441298
Barbecue Chicken,"[""Mix Coca-Cola, catsup, salt and pepper in boiler."", ""Add chicken pieces and cook until tender.""]","[""hot catsup"", ""coca-cola"", ""salt"", ""fryer""]",www.cookbooks.com/Recipe-Details.aspx?id=575417
Cornish Figgy 'Obbin ,"[""Mix together the suet, chestnut flour, sea salt and baking powder. Add water gradually, to form a dry elastic dough."", """", ""Knead lightly, then roll out to about 1/2\"" thick. Sprinkle on two handfuls of dried berries, roll them in lightly with a rolling pin."", """", ""Fold up, like a jam suet pudding, sealing the ends. Criss-cross the top with a knife, brush with buttermilk and sprinkle with birch sugar (xylitol)."", """", """", """", ""Bake at 350F for about 30 minutes. Serve hot.""]","[""baking powder"", ""suet"", ""sugar"", ""baking soda"", ""\u0095(buttermilk"", ""\u0095craisins"", ""flour"", ""salt""]",www.epicurious.com/recipes/member/views/cornish-figgy-obbin-52106811
Homemade Salsa,"[""Peel and finely chop tomatoes."", ""Stir together with chopped chili peppers, onion, green pepper and lemon juice."", ""Add parsley, garlic and pepper."", ""Place 1 cup tomato mixture in blender or processor."", ""Blend until just pureed."", ""Also blend in tomato sauce at the same time."", ""Stir all ingredients together."", ""Chill and store tightly covered in refrigerator."", ""Use as dip for chips or topper for main dishes.""]","[""tomatoes"", ""pepper"", ""lemon juice"", ""green onion"", ""green chili peppers"", ""clove garlic"", ""parsley"", ""green pepper"", ""tomato sauce""]",www.cookbooks.com/Recipe-Details.aspx?id=290033
"Winter Squash, Raisin And Pine Nut Lasagna","[""Place flour in a small saucepan. Gradually whisk in milk and garlic. Warm over low heat, stirring constantly, until sauce simmers and is thickened, about 3 minutes. Remove from heat and stir in cheese, salt and pepper. Spread 1/4 cup cheese sauce over bottom of baking dish and cover with 3 lasagna noodles. Top with 1/3 of squash, 1/2 cup cheese sauce, 1/2 cup Mozzarella cheese and 1/4 cup raisins. Cover with 3 more noodles and spread 1/3 of remaining squash, 1/2 cup cheese sauce and 1/4 cup raisins. Cover with 3 more lasagna noodles and top with remaining squash and raisins. Cover with last 3 noodles, pressing down firmly. Top with remaining cheese sauce and sprinkle with pine nuts and remaining Mozzarella cheese. Bake about 30 minutes in a 350\u00b0 oven until it bubbles around the edges and is brown on top.""]","[""pepper"", ""lasagna noodles"", ""parmesan cheese"", ""mozzarella cheese"", ""winter"", ""flour"", ""milk"", ""golden seedless raisins"", ""garlic"", ""pine nuts"", ""salt""]",www.cookbooks.com/Recipe-Details.aspx?id=85155
Rice And Peas,"[""Soak beans in"", ""water"", ""overnight."", ""In"", ""large"", ""pot, place beans in pot with"", ""2"", ""quarts"", ""water"", ""and cook over medium heat until they are tender enough to crush with the fingers (2 to 3 hours). Meanwhile, in a heavy skillet, add oil, brown onions, and seasoning with"", ""salted"", ""pork."", ""Also,"", ""add"", ""one"", ""cup of hot water to grated"", ""coconut\tand"", ""squeeze"", ""out"", ""cream"", ""through"", ""a strainer. Save cream"", ""and discard pulp."", ""To previously cooked peas, add coconut"", ""cream"", ""and"", ""seasoning."", ""Bring to a boil and add rice. Cook over"", ""medium heat until rice is cooked and all the water is absorbed, adding more water if necessary."", ""Serve fish, chicken or beef."", ""(Good with stew.)""]","[""oil"", ""onion"", ""water"", ""red kidney beans"", ""pork"", ""thyme"", ""coconut"", ""rice"", ""hot pepper"", ""salt""]",www.cookbooks.com/Recipe-Details.aspx?id=633438
Blueberry Barbecue Sauce Recipe,"[""Saute/fry the onions and jalapeno in extra virgin olive oil over medium-high heat in a small saucepan till limp, 2 to 3 min."", ""Add in the remaining ingredients and cook at a low boil for 15 min, stirring often."", ""Puree the sauce in a blender or possibly food processor till smooth.""]","[""brown sugar"", ""blueberries"", ""water"", ""rice wine vinegar"", ""onions"", ""mustard"", ""olive oil""]",cookeatshare.com/recipes/blueberry-barbecue-sauce-87743
Crunchy Baked Chicken Thighs with Grainy Mustard and Garlic,"[""Preheat the oven to 450."", ""Set a wire rack on a rimmed baking sheet."", ""In a large bowl, mix the mustards with the Worcestershire sauce, garlic and cayenne."", ""In a large, shallow dish, toss the bread crumbs with the butter, parsley and lemon zest."", ""Season the chicken with salt and black pepper."", ""Add to the mustard mixture and turn to coat."", ""Dredge the skinned side of 1 chicken thigh in the bread crumb mixture and transfer to the rack, crumb side up."", ""Repeat with the remaining chicken."", ""Transfer the chicken to the oven and bake for 30 minutes, until the crumbs are golden brown and the chicken is cooked through."", ""Serve with lemon wedges.""]","[""lemon wedges"", ""unsalted butter"", ""lemon zest"", ""freshly ground black pepper"", ""skinless"", ""kosher salt"", ""flat-leaf parsley"", ""garlic"", ""mustard"", ""bread crumbs"", ""worcestershire sauce"", ""grainy mustard""]",www.foodandwine.com/recipes/crunchy-baked-chicken-thighs-grainy-mustard-and-garlic
Flourless Peanut Butter Chocolate Chip Blender Muffins,"[""Preheat oven to 400 degrees F (200 degrees C). Spray a muffin tin with cooking spray."", ""Combine peanut butter, banana, honey, egg white, almond extract, baking soda, and sea salt in a blender; blend until smooth. Stir chocolate chips into the batter with a wooden spoon."", ""Pour batter into the prepared muffin tin, filling each cup 3/4 full."", ""Bake in the preheated oven until a toothpick inserted into the center comes out clean, about 9 minutes. Cool in the tin for 5 minutes; transfer to a baking rack to cool completely.""]","[""egg"", ""very ripe banana"", ""almond"", ""baking soda"", ""peanut butter"", ""cooking spray"", ""chocolate chips"", ""honey"", ""salt""]",www.allrecipes.com/recipe/257337/flourless-peanut-butter-chocolate-chip-blender-muffins/
Apple Celery Soup,"[""Wash, peel, core and chop apples. Chop onion and celery."", ""Melt butter in a stock pot over medium low heat. Add onions and cook until soft, about 5 minutes. Add celery and cook for 2 minutes more. Stir in apples and broth and bring to a boil over high heat. Reduce heat and simmer over medium low heat for 20 minutes. Remove from heat and puree with an immersion blender. Season with freshly ground pepper and serve warm, or chill for at least 1 hour to enjoy cold.""]","[""black pepper"", ""onion"", ""celery"", ""apples"", ""butter"", ""chicken""]",tastykitchen.com/recipes/soups/apple-celery-soup/
My Mom's Family Favorite Chili,"[""In a large saucepan, brown the ground beef and onion, stirring to break up any clumps."", ""Season with chili powder, salt, pepper, garlic powder, oregano, cumin, and cayenne, and stir in the remaining ingredients."", ""Bring quickly just to a boil, then immediately reduce heat to low and gently simmer with the pan partially covered, stirring occasionally (add a little water if it seems too thick), for about 45 minutes."", ""Taste and adjust seasonings."", ""Serve hot topped with grated cheddar cheese and chopped onions, with sides of warm cornbread."", ""Enjoy!""]","[""cumin"", ""kidney beans"", ""oregano"", ""tomatoes"", ""green bell pepper"", ""couple dashes"", ""chili powder"", ""cheddar cheese"", ""onion"", ""lean ground beef"", ""ground black pepper"", ""tomato sauce"", ""garlic"", ""salt""]",www.food.com/recipe/my-moms-family-favorite-chili-488413
Fudge Pie,"[""In a medium glass bowl, melt butter in the microwave for about 35 seconds."", ""Add all remaining ingredients and mix well by hand."", ""Pour into a lightly greased pie plate and bake for about 30 minutes or until knife inserted in center comes out clean.""]","[""sugar"", ""vanilla"", ""eggs"", ""flour"", ""cocoa"", ""butter""]",tastykitchen.com/recipes/desserts/fudge-pie/
Pineapple And Cheese Casserole,"[""Drain pineapple."", ""Save 3 tablespoons juice; arrange pineapple on the bottom of greased 1 1/2-quart casserole dish."", ""Stir together flour and sugar; sprinkle over pineapple."", ""Drizzle pineapple juice over top with cheese."", ""Mix crushed crackers and butter."", ""Pour over cheese."", ""Bake at 350\u00b0 for 15 minutes, covered. Uncover and bake for 10 minutes.""]","[""sugar"", ""crackers"", ""flour"", ""cheese"", ""butter"", ""pineapple""]",www.cookbooks.com/Recipe-Details.aspx?id=404723
