title,directions,Ingridents,link
Chocolate Sheet Cake,"[""--------ICING-----------."", ""COMBINE BUTTER, COCOA, AND MILK."", ""HEAT TO BOILING."", ""POUR OVER SUGAR AND NUTS."", ""SPREAD ON HOT CAKE (I LIKE TO POKE HOLES IN CAKE WITH FORK TO LET THE ICING OOZE INTO THE CAKE)."", ""--------CAKE-------------."", ""Combine sugar, flour, cocoa, baking soda, and salt in large bowl."", ""Mix well."", ""Heat butter and water to boiling."", ""Pour over dry ingredients, mix well."", ""Beat in buttermilk, eggs, vanilla."", ""Pour THIN batter into greased and floured sheet pan."", ""BAKE AT 400F degrees FOR 20 MINUTES."", ""REMOVE CAKE FROM OVEN AND POUR ON THE FROSTING.""]","[""buttermilk"", ""sugar"", ""vanilla"", ""baking soda"", ""eggs"", ""powdered sugar"", ""water"", ""flour"", ""nuts"", ""cocoa"", ""milk"", ""chocolate icing"", ""butter"", ""salt""]",www.food.com/recipe/chocolate-sheet-cake-11313
Baked Potatoes With Toppers,"[""Bake potatoes @ 350 * for about 1 1/2 hours."", ""Serve with toppings.""]","[""potatoes"", ""sour cream"", ""green onion"", ""ham"", ""cheese"", ""broccoli"", ""butter""]",www.food.com/recipe/baked-potatoes-with-toppers-326000
Potluck Pasta Salad,"[""Cook pasta according to package directions except add crushed red pepper to the cooking water."", ""Rinse with cool water and drain thoroughly."", ""Cool pasta to room temperature. In a large mixing bowl combine pasta, sweet red pepper, yellow squash or zucchini, peas, olives, cheese, almonds, green onions and herb."", ""Add dressing to pasta mixture. Toss gently to mix."", ""Cover and chill for 2 hours or up to 24 hours.""]","[""almonds"", ""wagon wheel macaroni"", ""macaroni"", ""cheddar cheese"", ""red pepper"", ""green onion"", ""italian salad dressing"", ""basil"", ""black olives"", ""sweet red pepper"", ""yellow squash"", ""frozen peas""]",www.food.com/recipe/potluck-pasta-salad-2891
Hamburger Stew,"[""Combine beef, bread crumbs, chopped onion,egg, salt, pepper, Worcestershire sauce (1/2 cup tomato sauce if you use it)."", ""Shape into balls- brown in hot oil in skillet."", ""Add vegetables, water."", ""Pour over remaining tomato sauce (or canned tomatoes)."", ""Cover and simmer 1 hr."", ""stirring occasionally."", ""Remove 1/2 cupsauce and mix with flour."", ""Gradually pour into stew and stir over low heat until thickened.""]","[""egg"", ""potato"", ""onion"", ""water"", ""breadcrumbs"", ""flour"", ""green beans"", ""carrot"", ""tomato sauce"", ""ground beef"", ""vegetable oil"", ""worcestershire sauce"", ""salt""]",www.food.com/recipe/hamburger-stew-51131
Roasted Red Pepper Tahini ,"[""Place all ingredients in a food processor fitted with the metal blade and process until smooth. Chill 20 minutes before serving."", """", ""Serve with pita chips or veggies.""]","[""extra-virgin olive-oil"", ""tomato paste"", ""red peppers"", ""lemon"", ""sesame tahini"", ""paprika"", ""garlic"", ""fresh basil"", ""salt""]",www.epicurious.com/recipes/member/views/roasted-red-pepper-tahini-52430081
Caprese Tartlets ( Recipe Courtesy Melissa D'Arabian),"[""Preheat the oven to 375 degrees F."", ""Remove the crusts from the bread and using a large spoon or rolling pin, gently press the slices of bread down flat until they are thin and almost doughy. Brush both sides of the bread with olive oil. Press the slices in the muffin tin, to form tartlet shells. Set aside."", ""In a small bowl, using a fork to combine, mix together the cream cheese, garlic powder, dried basil, salt, and pepper until smooth and creamy. Drop about a teaspoon of the cream cheese into the bottom of each muffin tin. Bake the tartlets until golden and crusty, 12 to 13 minutes."", ""Meanwhile, liberally salt the tomato slices. Once the tartlet shells are golden, remove them from the oven and transfer to a cooling rack. Place a slice of mozzarella on top of the cream cheese, then layer on a tomato slice or two. Season with salt and freshly ground black pepper, to taste and a drizzle of olive oil and balsamic vinegar, if using. Garnish with basil chiffonade.""]","[""extra-virgin olive oil"", ""mozzarella cheese"", ""cream cheese"", ""basil"", ""balsamic vinegar"", ""kosher salt"", ""white bread"", ""roma tomatoes"", ""garlic""]",www.food.com/recipe/caprese-tartlets-recipe-courtesy-melissa-darabian-438462
Hot Fudge Cake,"[""Bake cake mix as directed on box in sheet cake pan."", ""When done, while hot, poke holes in cake."", ""Pour Eagle Brand milk over cake. Then pour bottle of chocolate syrup over cake."", ""Cool.""]","[""maraschino cherries"", ""chocolate cake"", ""chocolate syrup"", ""milk""]",www.cookbooks.com/Recipe-Details.aspx?id=342791
Garlic Mashed Potatoes,"[""COOK potatoes and garlic in boiling water in large saucepan 20 minute or until potatoes are tender; drain."", ""MASH potatoes until smooth."", ""STIR in remaining ingredients until well blended."", ""Substitute: Omit garlic."", ""Prepare using PHILADELPHIA Spinach & Artichoke Cream Cheese Spread."", ""Nutrition Information Per Serving: 200 calories, 10g total fat, 6g saturated fat, 0g trans fat, 35mg cholesterol, 430mg sodium, 25g carbohydrate, 2g dietary fiber, 3g sugars, 3g protein, 8%DV vitamin A, 15%DV vitamin C, 4%DV calcium, 2%DV iron.""]","[""cream cheese"", ""baking potatoes"", ""garlic"", ""butter"", ""salt""]",www.food.com/recipe/garlic-mashed-potatoes-449799
Funny Face Cookies,"[""Allow both crusts to stand at room temperature for approximately 15 to 20 minutes."", ""Heat oven to 450\u00b0."", ""In a small bowl, lightly beat egg white and almond extract; set aside."", ""Cut dough rounds from crusts with floured 2 1/2-inch round cookie cutter."", ""Place 1 inch apart on ungreased cookie sheets."", ""Brush with egg white mixture; sprinkle with sugar."", ""Make funny faces with candy."", ""Brush dough scraps with egg white mixture and sprinkle with sugar."", ""Bake at 450\u00b0 for 5 to 7 minutes or until golden brown."", ""Immediately remove from cookie sheet."", ""Makes 2 dozen.""]","[""egg"", ""sugar"", ""beans"", ""pie crusts"", ""almond extract""]",www.cookbooks.com/Recipe-Details.aspx?id=730342
Onion White Wine Soup,"[""Melt butter in large saucepan."", ""Add chopped onions and mix well."", ""Add beef broth, celery leaves and potato."", ""Bring to boiling."", ""Cover and simmer for 30 minutes."", ""Puree mixture in a blender."", ""Return to saucepan and blend in wine, vinegar and sugar."", ""Bring to boiling and simmer 5 minutes."", ""Stir in cream, parsley and salt and pepper to taste."", ""Heat thoroughly but do not boil.""]","[""vinegar"", ""sugar"", ""potato"", ""beef broth"", ""celery"", ""onions"", ""white wine"", ""parsley"", ""light cream"", ""butter"", ""salt""]",www.food.com/recipe/onion-white-wine-soup-36955
Chili Bean Soup,"[""Saute chopped onion and celery."", ""Saute ground beef and drain fat."", ""Mix all ingredients and simmer for 1 or 1 1/2 hours.""]","[""celery stalks"", ""onion"", ""water"", ""minestrone soup"", ""beans"", ""ground beef"", ""ro-tel tomatoes""]",www.cookbooks.com/Recipe-Details.aspx?id=748966
Baked Sweet Potatoes,"[""Cut sweet potatoes in halves or quarters; place in baking dish."", ""In a small saucepan, bring to boil brown sugar, water, salt and butter."", ""Pour over sweet potatoes."", ""Bake at 350\u00b0 about 30 minutes, basting occasionally.""]","[""potatoes"", ""brown sugar"", ""water"", ""butter"", ""salt""]",www.cookbooks.com/Recipe-Details.aspx?id=427965
Homemade Brown Bread Ice Cream,"[""In a medium hot oven, bake/brown the breadcrumbs in a roasting tin for approx 10 to 15 mins, turning often."", ""Make a custard base using 1/2 pint (300ml) of the cream along with the sugar and egg yolks and leave to cool."", ""Directions for making a custard base:."", ""Ingredients: 4 egg yolks, 1/2 pint (250ml) milk, 1/2 pint (250ml) double/heavy cream, 4 oz (100g) sugar or caster sugar, 2 teaspoons vanilla extract (or according to taste)."", ""Scald the milk (bring slowly up to boiling point in a saucepan)."", ""Separately, mix together the egg yolks and sugar until thick."", ""Pour into this the hot milk, whilst continuously stirring. Then pour the mixture back into the pan and heat gently, stirring until the custard thickens - DO NOT BRING TO THE BOIL OR IT WILL PROBABLY CURDLE."", ""When you can see a film form over the back of your spoon it's time to remove the saucepan from the heat."", ""Leave to cool."", ""When the mixture is cold, stir in the breadcrumbs, vanilla extract and rest of the cream and then transfer the complete mixture into an ice cream maker."", ""Freeze following the manufacturer's instructions BUT just as it's starting to freeze whisk the egg whites until fluffy and add to the mixture, thereafter continuing the freezing process.""]","[""vanilla extract"", ""eggs"", ""caster sugar"", ""light cream"", ""brown breadcrumbs""]",www.food.com/recipe/homemade-brown-bread-ice-cream-121649
Bow Tie Pasta Salad With Fontina And Melon,"[""Cook pasta according to package directions; drain and rinse well."", ""In a large bowl toss together pasta, melon, and cheese. Combine salad dressing and mint; pour over pasta mixture and toss gently to coat."", ""Serve immediately or cover and chill up to 24 hours."", ""Add watercress to pasta mixture just prior to serving."", ""For a pretty presentation, pasta salad may be served in melon shells :).""]","[""fontina"", ""cantaloupe"", ""nonfat"", ""pasta"", ""mint""]",www.food.com/recipe/bow-tie-pasta-salad-with-fontina-and-melon-421995
Refrigerator Bran Muffins,"[""Combine first 5 ingredients in a large bowl."", ""Mix all wet ingredients and add to dry, stirring to moisten well."", ""Cover and store in refrigerator until ready to bake, as long as 5 to 6 weeks.""]","[""buttermilk"", ""oil"", ""baking soda"", ""eggs"", ""all-purpose"", ""box wheat bran"", ""whole wheat flour"", ""honey"", ""salt""]",www.cookbooks.com/Recipe-Details.aspx?id=946955
Low-Fat Crumb Cake,"[""Preheat oven to 350\u00b0."", ""Grease and flour 9 x 13-inch dish. Dump pineapple in dish, followed by can of cherry pie filling."", ""On top of that, dump dry cake mix."", ""Then, thinly slice margarine and spread over top of cake mix."", ""Bake for 1 hour at 350\u00b0."", ""It's best to eat it warm.""]","[""cherry pie filling"", ""margarine"", ""pineapple"", ""low-fat""]",www.cookbooks.com/Recipe-Details.aspx?id=339610
Zucchini And Green Chili Quiche,"[""Crust:"", ""Mix flour and salt."", ""Measure oil, milk and water in same cup (but don't stir)."", ""Pour all at once into flour; stir until mixed."", ""Press into smooth ball."", ""Cut in halves; flatten slightly."", ""Press one half between 2 sheets waxed paper, approximately 12-inches square."", ""Roll out gently to edges of paper."", ""Peel off top paper."", ""If dough tears, mend without moistening."", ""Lift paper and pastry by top corners."", ""Place paper side up in 9-inch deep dish pie pan. Peel off paper and fit pastry into pan."", ""Repeat for second pan.""]","[""salad oil"", ""water"", ""flour"", ""milk"", ""salt""]",www.cookbooks.com/Recipe-Details.aspx?id=769853
Cheesy Zucchini Casserole,"[""Put all ingredients into greased casserole in 2 layers with the cheese on top."", ""Cover."", ""Bake at 350\u00b0 for 1 1/2 hours.""]","[""oregano"", ""tomatoes"", ""mozzarella cheese"", ""parmesan cheese"", ""onion"", ""parsley flakes"", ""basil"", ""zucchini"", ""tomato sauce""]",www.cookbooks.com/Recipe-Details.aspx?id=378670
Chicken And Dumplings Like Cracker Barrel'S,"[""Place chicken in a Dutch oven. Add water and 2 teaspoons salt. Bring to a boil."", ""Cover, reduce the heat, and simmer for 1 hour or until tender (should almost fall off bone)."", ""Remove the chicken from the broth and cool. Bone the chicken and cut meat into bite-sized pieces."", ""Bring the broth to a boil and add pepper."", ""Combine the flour, baking soda, and salt. Cut in the shortening. Add the buttermilk, stirring with a fork until moistened."", ""Knead the dough 4 to 5 times (never done), and pat to 1/2-inch pieces and drop into boiling broth (I do not pat it out, just pinch off pieces). Reduce the heat to medium-low, and cook for about 8 to 10 minutes, stirring occasionally."", ""Stir in the chicken and serve. I make it in the pressure cooker, much quicker and easier."", ""I pressure it for only 30 minutes."", ""It can also be done in the crockpot with 3-4 cups water but someone has that book so at this time I cannot give cooking times."", ""Good Luck! Hope you enjoy.""]","[""buttermilk"", ""pepper"", ""shortening"", ""baking soda"", ""water"", ""flour"", ""frying chickens"", ""salt""]",www.food.com/recipe/chicken-and-dumplings-like-cracker-barrels-5000
Texas Sheet Cake,"[""Combine in a 2-quart saucepan the margarine, cocoa and water. Heat to boiling."", ""Remove and add flour, salt, soda and sugar. Beat until mixed."", ""Add 1/2 cup sour cream and eggs; blend."", ""Bake at 375\u00b0 for 22 minutes in a greased pan (15 x 11 1/2-inch).""]","[""sour cream"", ""sugar"", ""eggs"", ""soda"", ""water"", ""flour"", ""cocoa"", ""margarine"", ""salt""]",www.cookbooks.com/Recipe-Details.aspx?id=1068855
Impossible Coconut Pie,"[""Grease and flour two pie pans."", ""Beat eggs well, add sugar, flour and milk."", ""Add vanilla and melted butter."", ""Stir in coconut and divide mixture in 2 pie pans."", ""Bake in 350\u00b0 oven for 25 minutes or until golden brown.""]","[""sugar"", ""shredded coconut"", ""vanilla"", ""eggs"", ""flour"", ""milk"", ""butter""]",www.cookbooks.com/Recipe-Details.aspx?id=219716
Butter Pecan Ice Cream,"[""Melt the butter in a small saucepan."", ""Over low heat, cook the pecans until they are lightly browned, about 3 minutes."", ""Place on a paper towel to drain and cool."", ""In an 8-cup measuring cup with a spout, combine the remaining ingredients."", ""Whisk until the sugar is dissolved."", ""Pour the mixture into an ice cream maker and freeze according to manufacturers' instructions."", ""Add the pecans 10 minutes into the freezing.""]","[""sugar"", ""vanilla"", ""pecans"", ""milk"", ""butter""]",www.foodnetwork.com/recipes/paula-deen/butter-pecan-ice-cream-recipe2.html
Weeknight Taco Soup,"[""In a Dutch oven, heat oil over medium heat. Add onion and peppers; cook and stir until crisp-tender, 3-5 minutes."", ""Add tomatoes, broth, beans, corn, taco seasoning, salt and pepper; bring to a boil. Reduce heat; simmer, uncovered, until vegetables are tender, 10-15 minutes. Reduce heat. Stir in rice and sour cream; heat through. Serve with toppings as desired."", ""Freeze cooled soup in freezer containers. To use, partially thaw in refrigerator overnight. Heat through in a saucepan, stirring occasionally; add a little broth if necessary.""]","[""frozen corn"", ""sour cream"", ""tomatoes"", ""pepper"", ""toppings"", ""taco"", ""onion"", ""canola oil"", ""vegetable broth"", ""pinto beans"", ""sweet red pepper"", ""ready"", ""green pepper"", ""salt""]",www.tasteofhome.com/recipes/weeknight-taco-soup/
Tortellini With Mushroom Sauce,"[""Cook mushrooms in hot oil for 2-3 minutes."", ""Stir in undrained diced tomatoes, tomato sauce and garlic powder."", ""Bring to a boil; reduce heat and simmer, covered 5 minutes."", ""Spoon over pasta.""]","[""tomatoes"", ""cheese tortellini"", ""mushrooms"", ""garlic"", ""olive oil"", ""tomato sauce""]",www.food.com/recipe/tortellini-with-mushroom-sauce-219297
Bobbie'S Layered Vegetable Salad,"[""In a covered 9 x 13-inch pan, layer the lettuce, celery, onions, peppers and peas in that order."", ""Spread the mayonnaise over the top."", ""On top of the mayonnaise, sprinkle the cheese, then the eggs and tomatoes."", ""Refrigerate overnight."", ""Serve."", ""Makes 12 servings.""]","[""head lettuce"", ""tomatoes"", ""green peppers"", ""eggs"", ""stalks celery"", ""parmesan cheese"", ""onion"", ""green peas"", ""mayonnaise""]",www.cookbooks.com/Recipe-Details.aspx?id=1000024
Spiced Pork Chops And Apple Chutney,"[""Melt butter in medium sized sauce pan over medium-high heat, fry sage leaves until crisp (about 2 minutes). Remove sage leaves and set aside for garnish."", ""In the same pan add the cider vinegar, sugar, ginger, nutmeg, shallot, and apples. Reduce to medium heat and cook until apples soften, stirring occasionally."", ""In a 12 inch saute pan, heat 2 tbsp olive oil over medium-high heat."", ""Rinse pork chops and pat dry. Season with salt, pepper, and cumin. Add to pan and sear both sides, about 2 minutes each. Reduce to medium heat and let them cook through, about 5 minutes."", ""Serve pork chops topped with chutney and garnished with whole sage leaves.""]","[""apple cider"", ""coarse salt"", ""ground cumin"", ""shallot"", ""fresh ginger"", ""nutmeg"", ""brown sugar"", ""ground black pepper"", ""sage"", ""apples"", ""pork chops"", ""butter"", ""olive oil""]",www.yummly.com/recipe/Spiced-Pork-Chops-and-Apple-Chutney-1343271
Grandpa's Potato Salad Recipe,"[""Cook potatoes and boil Large eggs."", ""Peel and slice both."", ""Slice onions, pepper, celery and green olives."", ""Slice green olives."", ""Mix all ingredients together; add in caraway seeds and salt and pepper to taste."", ""Mix together 1 c. each of lowfat sour cream, vinegar and Miracle Whip."", ""Pour dressing over salad."", ""You might like less so taste as you go.""]","[""potatoes"", ""green olives"", ""green onions"", ""caraway seeds"", ""eggs"", ""stalks celery"", ""green pepper"", ""salt""]",cookeatshare.com/recipes/grandpa-s-potato-salad-51182
Tortilla Roll-Ups,"[""Mix cream cheese, beans, seasoning mix, onion and grated cheese."", ""Spread on tortillas."", ""Roll each tortilla tightly, jelly roll fashion, and place seam side down on a baking sheet."", ""Cover and refrigerate for 2 hours."", ""Slice each in 1-inch slices and serve.""]","[""tortilla shells"", ""cheddar cheese"", ""onion"", ""cream cheese"", ""taco seasoning mix"", ""beans""]",www.cookbooks.com/Recipe-Details.aspx?id=207538
Braised Red Cabbage & Apples,"[""1. Preheat oven to 300\u00b0F. Grease a large baking dish or Dutch oven with 1 teaspoon butter."", ""2. Arrange half the shredded cabbage in the bottom of the dish. Top with half the apples, onion and garlic. Sprinkle with half the allspice, half the honey and a pinch each of salt and pepper. Repeat the process with a second layer using the remaining ingredients."", ""3. Pour vinegar over top of everything. Dot small pieces of the remaining 2 teaspoons butter over top. Cover the dish with a lid and bake in the preheated oven for 2 hours, stirring every 30 minutes, until cabbage is tender. Remove from the oven and serve with grilled bratwursts or pork chops. Mashed potatoes make a great accompaniment, too!""]","[""spice"", ""onion"", ""red cabbage"", ""apples"", ""white wine vinegar"", ""butter"", ""garlic"", ""honey"", ""salt""]",tastykitchen.com/recipes/sidedishes/braised-red-cabbage-apples/
Nacho Cheesy Quesadillas,"[""Heat the oven to 425 degrees F."", ""Cook the chicken in a 10-inch nonstick skillet over medium-high heat until well browned and cooked through, stirring often."", ""Stir in the soup and water and cook until the mixture is hot and bubbling."", ""Place the tortillas onto 2 baking sheets."", ""Spoon about 1/3 cup chicken mixture onto half of each tortilla."", ""Brush the edges of the tortillas with water."", ""Fold the tortillas over the filling and press the edges to seal."", ""Bake for 5 minutes or until the filling is hot."", ""Cut the quesadillas into wedges and serve with the salsa.Vitamin A 6%DV, Vitamin C 0%DV, Calcium 9%DV, Iron 12%DV""]","[""water"", ""salsa"", ""flour"", ""skinless"", ""campbell's condensed fiesta""]",www.delish.com/recipefinder/nacho-cheesy-quesadillas-recipe-campbells-1109
Green Tomato Pie,"[""Pasty Shell (this wil make 5 singles but freezes nicely): Sift Flour, cut shortening and salt."", ""slowly add coke till forms a ball."", ""Roll out thinly on floured surfuce (Makes 5 single pie crust) (Freezes very well) Green Tomato Filling: Place tomato slices into a bowl and cover with boiling boiling water."", ""Let stand 3 mins; drain."", ""Combine sugar, salt, flour, and spices in a small bowl."", ""Fill pastry lined pie shell with layers of green tomato slices, sprinkle, each layer with sugar mixture,pats of butter, and sm amount of lemon mix."", ""Cover filling with a top crust."", ""Bake at 450 drgrees for 8- 10 minutes; reduce heat to 375 degrees and bake an additional 40 minutes or untill tomatoes are tender.""]","[""sugar"", ""regular"", ""shortening"", ""nutmeg"", ""cinnamon"", ""flour"", ""unpeeled green tomatoes"", ""lemon"", ""boiling water"", ""butter"", ""salt""]",www.food.com/recipe/green-tomato-pie-65032
Strawberry Angel Delight,"[""Blend sugar, cornstarch and salt in a 2-quart saucepan. Combine milk and egg yolks; gradually stir into sugar mixture. Cook over medium heat, stirring constantly, until mixture thickens and"", ""boils."", ""Boil and stir one minute."", ""Remove from heat; stir in butter and vanilla."", ""Cool slightly and chill.""]","[""sugar"", ""vanilla"", ""vanilla cream pudding"", ""cornstarch"", ""milk"", ""butter"", ""egg yolks"", ""salt""]",www.cookbooks.com/Recipe-Details.aspx?id=287203
Choco-Crunch Brownies,"[""Cream butter and sugar."", ""Add eggs."", ""Stir in cocoa, flour, vanilla and salt."", ""Spread into a 9 x 13-inch pan."", ""Bake for 20 to 25 minutes at 350\u00b0."", ""Cool."", ""Spread marshmallow cream over top. Melt the chocolate chips and peanut butter; stir in Rice Krispies. Spread over the marshmallow layer."", ""Chill before cutting."", ""Store in refrigerator.""]","[""sugar"", ""vanilla"", ""eggs"", ""marshmallow cream"", ""peanut butter"", ""flour"", ""cocoa"", ""rice krispies"", ""chocolate chips"", ""butter"", ""salt""]",www.cookbooks.com/Recipe-Details.aspx?id=877855
Carrot And Raisin Salad,"[""Mix all ingredients together and enjoy."", ""For variety, you may add 1/2 c. chopped nuts.""]","[""sugar"", ""raisins"", ""mayo"", ""carrots"", ""pineapple""]",www.cookbooks.com/Recipe-Details.aspx?id=6151
Pennsylvania Dutch Potato Doughnuts,"[""In a large bowl, combine the potatoes, milk, eggs and butter. Combine the sugar, baking powder and 2 cups flour; stir into potato mixture. Add enough remaining flour to form a soft dough. Refrigerate, covered, 1 hour."", ""Divide dough in half. Turn each half onto a lightly floured surface; roll to 1/2-in. thickness. Cut with a 2-3/4-in. doughnut cutter."", ""In an electric skillet or deep-fat fryer, heat oil to 375\u00b0. Fry doughnuts, a few at a time, until golden brown on both sides. Drain on paper towels."", ""In a small bowl, mix glaze ingredients until smooth. Drizzle over warm doughnuts.""]","[""potatoes"", ""sugar"", ""baking powder"", ""vanilla"", ""eggs"", ""flour"", ""milk"", ""cream"", ""butter""]",www.tasteofhome.com/recipes/pennsylvania-dutch-potato-doughnuts/
Ham Casserole,"[""Following package directions, cook and drain rigatoni."", ""Cook onion in oil until tender."", ""Add flour; cook 1 minute."", ""Add milk; stir with a whisk."", ""Add 1/2 of the cheese and the noodles, then put in peas and ham."", ""Mix good and put in casserole dish."", ""Top with rest of cheese."", ""Bake at 350\u00b0 for 25 to 30 minutes.""]","[""rigatoni"", ""salad oil"", ""mozzarella cheese"", ""onion"", ""ham"", ""flour"", ""milk"", ""frozen peas""]",www.cookbooks.com/Recipe-Details.aspx?id=1068625
Special CHOCOLATE Doughnuts w/ Glaze,"[""Combine all of the glaze ingredients,beat until smoothy."", ""With electric mixer,on medium speed,beat the eggs until frothy."", ""Gradually,add in sugar continue to beat until thick and lemon colored."", ""Add 1/4 cup vegetable oil and vanilla extract,stir well."", ""Combine next 6 ingredients."", ""Add to egg mixture alternatly with buttermilk,begining& ending with flour mixture."", ""Cover the dough and refridgerate for several hours."", ""Divide dough in half,using one half at a time,put on lightly floured surface."", ""Roll dough out to 1/2\"" thickness& cut with floured 2 1/2\"" doughnut cutter."", ""Heat 2-3 inches of oil to 375 degrees."", ""Drop 4 or 5 doughnuts at a time."", ""Fry until golden or around a minute,turn over to golden each side."", ""Drain doughnuts well on paper towels."", ""Dip in Glaze,cool on wax paper.""]","[""buttermilk"", ""sugar"", ""vanilla"", ""baking powder"", ""eggs"", ""cinnamon"", ""baking soda"", ""powdered sugar"", ""all-purpose"", ""cocoa"", ""milk"", ""vegetable oil"", ""salt""]",www.food.com/recipe/special-chocolate-doughnuts-w-glaze-34010
Barbecue Sauce,"[""Mix ingredients in saucepan and heat; serve with favorite meat.""]","[""vinegar"", ""sugar"", ""chili powder"", ""catsup"", ""paprika"", ""dry mustard"", ""worcestershire sauce"", ""salt""]",www.cookbooks.com/Recipe-Details.aspx?id=762764
